index,title,url,video_id,uploader,uploader_id,uploader_url,upload_date,duration,view_count,like_count,comment_count,tags,categories,description,thumbnail,age_limit,is_live,was_live,availability,webpage_url,original_url
65,"Philip James, Asheesh Laroia - Type python, press enter. What happens? - PyCon 2015",https://www.youtube.com/watch?v=XVhSjZYwZJo,XVhSjZYwZJo,PyCon 2015,@PyCon2015,https://www.youtube.com/@PyCon2015,20150411,1565,2190,28,6.0,,Education,"""Speakers: Philip James, Asheesh Laroia

This talk discusses how the Python interpreter starts, from the perspective of the operating system (OS). Together, we will see the ins & outs of processes: fork(), exec(), stdin, and stdout.

It focuses on OS concepts and requires no background knowledge, using analogies to Python data structures. (The talk does not discuss Python’s own initialization, such as site.py or global variables.)

Slides can be found at: https://speakerdeck.com/pycon2015 and https://github.com/PyCon/2015-slides""",https://i.ytimg.com/vi/XVhSjZYwZJo/maxresdefault.jpg,0,False,False,public,https://www.youtube.com/watch?v=XVhSjZYwZJo,https://www.youtube.com/watch?v=XVhSjZYwZJo
66,Kate Heddleston - How our engineering environments are killing diversity (and how we can fix it).,https://www.youtube.com/watch?v=kNke_4WOWAU,kNke_4WOWAU,PyCon 2015,@PyCon2015,https://www.youtube.com/@PyCon2015,20150411,2388,8541,101,2.0,,Education,"""Speaker: Kate Heddleston

This talk focuses on how engineering team environments can impact employee behavior, and how environmental factors can prohibit diversity at tech companies. I will talk about some of the key problems that exist in current engineering environments and how they can be fixed.

Slides can be found at: https://speakerdeck.com/pycon2015 and https://github.com/PyCon/2015-slides""",https://i.ytimg.com/vi/kNke_4WOWAU/maxresdefault.jpg,0,False,False,public,https://www.youtube.com/watch?v=kNke_4WOWAU,https://www.youtube.com/watch?v=kNke_4WOWAU
67,Michael Scherer - Ansible beyond YAML - PyCon 2015,https://www.youtube.com/watch?v=igJTEugHozM,igJTEugHozM,PyCon 2015,@PyCon2015,https://www.youtube.com/@PyCon2015,20150411,1714,2728,7,1.0,,Education,"""Speaker: Michael Scherer

Ansible is a configuration management tool whose primary mode of operation involve using YAML to describe deployments and operations. However, it can do much more and be extended using python, which is what we will explore in this talk. Among others, we will see the plugins system for various part of the tool and how to reuse Ansible in a script.

Slides can be found at: https://speakerdeck.com/pycon2015 and https://github.com/PyCon/2015-slides""",https://i.ytimg.com/vi/igJTEugHozM/maxresdefault.jpg,0,False,False,public,https://www.youtube.com/watch?v=igJTEugHozM,https://www.youtube.com/watch?v=igJTEugHozM
68,Andreas Dewes - Learning from other's mistakes: Data-driven analysis of Python code - PyCon 2015,https://www.youtube.com/watch?v=rN0kNQLDYCI,rN0kNQLDYCI,PyCon 2015,@PyCon2015,https://www.youtube.com/@PyCon2015,20150411,1549,2590,18,6.0,,Education,"""Speaker: Andreas Dewes

Static code analysis is an useful tool that can help to detect bugs early in the software development life cycle. I will explain the basics of static analysis and show the challenges we face when analyzing Python code. I will introduce a data-driven approach to code analysis that makes use of public code and example-based learning and show how it can be applied to analyzing Python code.

Slides can be found at: https://speakerdeck.com/pycon2015 and https://github.com/PyCon/2015-slides""",https://i.ytimg.com/vi/rN0kNQLDYCI/maxresdefault.jpg,0,False,False,public,https://www.youtube.com/watch?v=rN0kNQLDYCI,https://www.youtube.com/watch?v=rN0kNQLDYCI
69,"Dan Crosta - Good Test, Bad Test - PyCon 2015",https://www.youtube.com/watch?v=RfR_QRoNZxo,RfR_QRoNZxo,PyCon 2015,@PyCon2015,https://www.youtube.com/@PyCon2015,20150411,1464,3061,29,,,Education,"""Speaker: Dan Crosta

In a highly dynamic language like Python, testing is even more critical than in compiled or more static languages. Like any other code we produce, tests can be either good or bad. This talk explores three fallacies of testing, and the mistakes and bad habits these fallacies encourage; and shows how to write good tests which help assure proper behavior without impeding development progress.

Slides can be found at: https://speakerdeck.com/pycon2015 and https://github.com/PyCon/2015-slides""",https://i.ytimg.com/vi/RfR_QRoNZxo/maxresdefault.jpg,0,False,False,public,https://www.youtube.com/watch?v=RfR_QRoNZxo,https://www.youtube.com/watch?v=RfR_QRoNZxo
70,Amy Hanlon - Investigating Python Wats - PyCon 2015,https://www.youtube.com/watch?v=sH4XF6pKKmk,sH4XF6pKKmk,PyCon 2015,@PyCon2015,https://www.youtube.com/@PyCon2015,20150411,1449,13105,192,13.0,,Education,"""Speaker: Amy Hanlon

Many of us have experienced a """"wat"""" in Python - some behavior that totally mystifies us. We'll look at three areas where wats arise - identity, mutability, and scope. For each of these three topics, we'll look at some common surprising behaviors, investigate the cause of the behaviors, and cover some practical tips on how to avoid related bugs.

Slides can be found at: https://speakerdeck.com/pycon2015 and https://github.com/PyCon/2015-slides""",https://i.ytimg.com/vi/sH4XF6pKKmk/maxresdefault.jpg,0,False,False,public,https://www.youtube.com/watch?v=sH4XF6pKKmk,https://www.youtube.com/watch?v=sH4XF6pKKmk
71,Greg Ward - How to Write Reusable Code - PyCon 2015,https://www.youtube.com/watch?v=r9cnHO15YgU,r9cnHO15YgU,PyCon 2015,@PyCon2015,https://www.youtube.com/@PyCon2015,20150411,1792,45781,663,20.0,,Education,"""Speaker: Greg Ward

Learning to write high-quality, reusable code takes years of dedicated work. Or you can take a shortcut: attend this talk and learn some of the tricks I've figured out over a couple of decades of programming.

Slides can be found at: https://speakerdeck.com/pycon2015 and https://github.com/PyCon/2015-slides""",https://i.ytimg.com/vi/r9cnHO15YgU/maxresdefault.jpg,0,False,False,public,https://www.youtube.com/watch?v=r9cnHO15YgU,https://www.youtube.com/watch?v=r9cnHO15YgU
72,Julia Evans - Systems programming as a swiss army knife - PyCon 2015,https://www.youtube.com/watch?v=5v6o-VsLAew,5v6o-VsLAew,PyCon 2015,@PyCon2015,https://www.youtube.com/@PyCon2015,20150411,1578,22510,280,17.0,,Education,"""Speaker: Julia Evans

You might think of the Linux kernel as something that only kernel developers need to know about. Not so! It turns out that understanding some basics about kernels and systems programming makes you a better developer, and you can use this knowledge when debugging your normal everyday Python programs.

Slides can be found at: https://speakerdeck.com/pycon2015 and https://github.com/PyCon/2015-slides""",https://i.ytimg.com/vi/5v6o-VsLAew/maxresdefault.jpg,0,False,False,public,https://www.youtube.com/watch?v=5v6o-VsLAew,https://www.youtube.com/watch?v=5v6o-VsLAew
73,Lightning Talks - April 11th 8h30- Pycon 2015,https://www.youtube.com/watch?v=byClBydNI1A,byClBydNI1A,PyCon 2015,@PyCon2015,https://www.youtube.com/@PyCon2015,20150411,1400,934,9,1.0,,Education,Lightning Talks - April 11th 8h30- Pycon 2015,https://i.ytimg.com/vi/byClBydNI1A/maxresdefault.jpg,0,False,False,public,https://www.youtube.com/watch?v=byClBydNI1A,https://www.youtube.com/watch?v=byClBydNI1A
74,Lightning Talks - April 10th - Pycon 2015,https://www.youtube.com/watch?v=yws4n-0-Yj8,yws4n-0-Yj8,PyCon 2015,@PyCon2015,https://www.youtube.com/@PyCon2015,20150411,3493,1655,8,1.0,,Education,,https://i.ytimg.com/vi_webp/yws4n-0-Yj8/maxresdefault.webp,0,False,False,public,https://www.youtube.com/watch?v=yws4n-0-Yj8,https://www.youtube.com/watch?v=yws4n-0-Yj8
75,Sarina Canelake - I18N: World Domination the Easy Way - PyCon 2015,https://www.youtube.com/watch?v=UOOMFGURr5I,UOOMFGURr5I,PyCon 2015,@PyCon2015,https://www.youtube.com/@PyCon2015,20150411,1868,2736,53,1.0,,Education,"""Speaker: Sarina Canelake

Have you heard about internationalization (i18n) and wondered what it meant? Perhaps your project already has i18n of its strings but you have a nagging feeling you could be doing it better. This talk will walk through the basics of i18n’ing a Django project (but the principles apply to any project!), and how to make the process of localization (l10n) go more smoothly.

Slides can be found at: https://speakerdeck.com/pycon2015 and https://github.com/PyCon/2015-slides""",https://i.ytimg.com/vi/UOOMFGURr5I/maxresdefault.jpg,0,False,False,public,https://www.youtube.com/watch?v=UOOMFGURr5I,https://www.youtube.com/watch?v=UOOMFGURr5I
76,Josh Triplett - Porting Python to run without an OS - PyCon 2015,https://www.youtube.com/watch?v=bYQ_lq5dcvM,bYQ_lq5dcvM,PyCon 2015,@PyCon2015,https://www.youtube.com/@PyCon2015,20150411,1977,20142,484,20.0,,Education,"""Speaker: Josh Triplett

We've ported Python to run directly on hardware, without an OS, as a testing and exploration environment for firmware, ACPI, and UEFI. This talk will explore porting Python to a new platform, embedding Python, recreating enough of libc and POSIX to run Python without an OS, and binding to platform-specific services. Includes live demo of bare-metal Python, directly driving hardware.

Slides can be found at: https://speakerdeck.com/pycon2015 and https://github.com/PyCon/2015-slides""",https://i.ytimg.com/vi/bYQ_lq5dcvM/maxresdefault.jpg,0,False,False,public,https://www.youtube.com/watch?v=bYQ_lq5dcvM,https://www.youtube.com/watch?v=bYQ_lq5dcvM
77,How to build a brain with Python,https://www.youtube.com/watch?v=7hvpoLKJHOw,7hvpoLKJHOw,PyCon 2015,@PyCon2015,https://www.youtube.com/@PyCon2015,20150411,2121,87217,882,18.0,,Education,,https://i.ytimg.com/vi/7hvpoLKJHOw/maxresdefault.jpg,0,False,False,public,https://www.youtube.com/watch?v=7hvpoLKJHOw,https://www.youtube.com/watch?v=7hvpoLKJHOw
78,Jeff Schenck - The REST Ascendancy - PyCon 2015,https://www.youtube.com/watch?v=HxP0lQCCiVo,HxP0lQCCiVo,PyCon 2015,@PyCon2015,https://www.youtube.com/@PyCon2015,20150411,1906,1447,10,3.0,,Education,"""Speaker: Jeff Schenck

As frontend web frameworks like AngularJS and Backbone.js take over, is Python on the server destined to be demoted to a basic REST interface? If we embrace our new JavaScript overlords, how do we ensure Python is best positioned for this new world of REST on the server? 

Slides can be found at: https://speakerdeck.com/pycon2015 and https://github.com/PyCon/2015-slides""",https://i.ytimg.com/vi/HxP0lQCCiVo/maxresdefault.jpg,0,False,False,public,https://www.youtube.com/watch?v=HxP0lQCCiVo,https://www.youtube.com/watch?v=HxP0lQCCiVo
79,Fire your supervisord running Python apps on CoreOS,https://www.youtube.com/watch?v=jCor69OeR0g,jCor69OeR0g,PyCon 2015,@PyCon2015,https://www.youtube.com/@PyCon2015,20150411,2383,3706,24,,,Education,,https://i.ytimg.com/vi/jCor69OeR0g/maxresdefault.jpg,0,False,False,public,https://www.youtube.com/watch?v=jCor69OeR0g,https://www.youtube.com/watch?v=jCor69OeR0g
80,Chris McDonough - Using Supervisor For Fun And Profit - PyCon 2015,https://www.youtube.com/watch?v=p0iQfT85IvM,p0iQfT85IvM,PyCon 2015,@PyCon2015,https://www.youtube.com/@PyCon2015,20150411,1760,4731,56,1.0,,Education,"""Speaker: Chris McDonough

Supervisor is a popular Python application that lets you control and monitor process state on UNIX-like systems.  This talk describes what it is, and how to use it effectively to make your application deployments better.

Slides can be found at: https://speakerdeck.com/pycon2015 and https://github.com/PyCon/2015-slides""",https://i.ytimg.com/vi/p0iQfT85IvM/maxresdefault.jpg,0,False,False,public,https://www.youtube.com/watch?v=p0iQfT85IvM,https://www.youtube.com/watch?v=p0iQfT85IvM
81,"Renee Chu, Matt Makai - Don't Make Us Say We Told You So: virtualenv for New Pythonistas",https://www.youtube.com/watch?v=Xdv7vwIIThY,Xdv7vwIIThY,PyCon 2015,@PyCon2015,https://www.youtube.com/@PyCon2015,20150411,1641,2085,21,,,Education,"""Speakers: Renee Chu, Matt Makai

Even though it’s possible to program without using virtual environments, you can shoot yourself in the foot without them. This talk will start with an illustration of how not using virtual environments can mess you up as a programmer, and will walk you through a simple way to get started with good habits using virtualenv.

Slides can be found at: https://speakerdeck.com/pycon2015 and https://github.com/PyCon/2015-slides""",https://i.ytimg.com/vi/Xdv7vwIIThY/maxresdefault.jpg,0,False,False,public,https://www.youtube.com/watch?v=Xdv7vwIIThY,https://www.youtube.com/watch?v=Xdv7vwIIThY
82,Losing your Loops Fast Numerical Computing with NumPy,https://www.youtube.com/watch?v=EEUXKG97YRw,EEUXKG97YRw,PyCon 2015,@PyCon2015,https://www.youtube.com/@PyCon2015,20150411,1831,81825,1917,55.0,,Education,,https://i.ytimg.com/vi/EEUXKG97YRw/maxresdefault.jpg,0,False,False,public,https://www.youtube.com/watch?v=EEUXKG97YRw,https://www.youtube.com/watch?v=EEUXKG97YRw
83,Melanie Warrick - Neural Nets for Newbies - PyCon 2015,https://www.youtube.com/watch?v=g-BJSl4zV_g,g-BJSl4zV_g,PyCon 2015,@PyCon2015,https://www.youtube.com/@PyCon2015,20150411,1857,19480,298,11.0,,Education,"""Speaker: Melanie Warrick

Neural networks have regained popularity in the last decade, but they get dismissed as being too complicated to understand and implement. This talk breaks down the neural net structure as simply as possible, so you have a framework on which to grow your knowledge in the space. I will put neural nets in the context of real-world applications and share Python packages and code where you can get started building your own. Coming out this talk you won't know everything about neural nets, but you will walk away with a solid foundation and some resources on where to go next to learn more.

Slides can be found at: https://speakerdeck.com/pycon2015 and https://github.com/PyCon/2015-slides""",https://i.ytimg.com/vi/g-BJSl4zV_g/maxresdefault.jpg,0,False,False,public,https://www.youtube.com/watch?v=g-BJSl4zV_g,https://www.youtube.com/watch?v=g-BJSl4zV_g
84,Raymond Hettinger - Super considered super! - PyCon 2015,https://www.youtube.com/watch?v=EiOglTERPEo,EiOglTERPEo,PyCon 2015,@PyCon2015,https://www.youtube.com/@PyCon2015,20150411,2812,126343,1903,98.0,,Education,"""Speaker: Raymond Hettinger

Python's super() is well-designed and powerful, but it can be tricky to use if you don't know all the moves.

This talk offers clear, practical advice with real-world use cases on how to use super() effectively and not get tripped-up by common mistakes.


Slides can be found at: https://speakerdeck.com/pycon2015 and https://github.com/PyCon/2015-slides""",https://i.ytimg.com/vi/EiOglTERPEo/maxresdefault.jpg,0,False,False,public,https://www.youtube.com/watch?v=EiOglTERPEo,https://www.youtube.com/watch?v=EiOglTERPEo
85,Jenny Cheng - 3D Print Anything with the Blender API - PyCon 2015,https://www.youtube.com/watch?v=ikcHP0Hd8Kc,ikcHP0Hd8Kc,PyCon 2015,@PyCon2015,https://www.youtube.com/@PyCon2015,20150411,1917,1709,7,1.0,,Education,,https://i.ytimg.com/vi/ikcHP0Hd8Kc/maxresdefault.jpg,0,False,False,public,https://www.youtube.com/watch?v=ikcHP0Hd8Kc,https://www.youtube.com/watch?v=ikcHP0Hd8Kc
86,Titus Brown - How to interpret your own genome using (mostly) Python. - PyCon 2015,https://www.youtube.com/watch?v=jV4YMQHZmMk,jV4YMQHZmMk,PyCon 2015,@PyCon2015,https://www.youtube.com/@PyCon2015,20150411,2681,4746,67,4.0,,Education,"""Speaker: Titus Brown

We’ve entered the era of the $1000 human genome, and soon it will be straightforward to get your own genome sequenced by a commercial company.  But what does the data mean? What information can you get out of your genomic sequence? And what are the barriers to deeper analysis?  What kinds of algorithms and databases are used in genomic analysis? All this, and more, will be revealed in this talk.

Slides can be found at: https://speakerdeck.com/pycon2015 and https://github.com/PyCon/2015-slides""",https://i.ytimg.com/vi/jV4YMQHZmMk/maxresdefault.jpg,0,False,False,public,https://www.youtube.com/watch?v=jV4YMQHZmMk,https://www.youtube.com/watch?v=jV4YMQHZmMk
87,Miguel Grinberg - Is Your REST API RESTful? - PyCon 2015,https://www.youtube.com/watch?v=pZYRC8IbCwk,pZYRC8IbCwk,PyCon 2015,@PyCon2015,https://www.youtube.com/@PyCon2015,20150411,2730,18374,261,20.0,,Education,"""Speaker: Miguel Grinberg

Writing a fully complaint REST API is hard, so hard it is too common for APIs to violate one or more of the REST architectural principles. In this talk I will describe the six REST principles, and I will tell you what happens if you don't follow them.

Slides can be found at: https://speakerdeck.com/pycon2015 and https://github.com/PyCon/2015-slides""",https://i.ytimg.com/vi/pZYRC8IbCwk/maxresdefault.jpg,0,False,False,public,https://www.youtube.com/watch?v=pZYRC8IbCwk,https://www.youtube.com/watch?v=pZYRC8IbCwk
88,Kenny Yarboro - Building a REST API Using Django & Django REST Framework - PyCon 2015,https://www.youtube.com/watch?v=PwssEec3IRw,PwssEec3IRw,PyCon 2015,@PyCon2015,https://www.youtube.com/@PyCon2015,20150411,4316,12881,47,11.0,,Education,"---Partial tutorial, only the beginning of the tutorial was recorded, sorry for the inconvenience---

""Speaker: Kenny Yarboro

Using a combination of Django and Django REST Framework, we will build a Restaurant Menu that can be managed via a REST API. Starting from the install of the Django REST Framework, we will build our way to a functional API that meets the needs of developers and end-users. You will walk away with an understanding of the basic concepts of REST APIs and a working sample project.

Slides can be found at: https://speakerdeck.com/pycon2015 and https://github.com/PyCon/2015-slides""",https://i.ytimg.com/vi/PwssEec3IRw/maxresdefault.jpg,0,False,False,public,https://www.youtube.com/watch?v=PwssEec3IRw,https://www.youtube.com/watch?v=PwssEec3IRw
89,Dan Callahan - My Python's a little Rust-y - PyCon 2015,https://www.youtube.com/watch?v=3CwJ0MH-4MA,3CwJ0MH-4MA,PyCon 2015,@PyCon2015,https://www.youtube.com/@PyCon2015,20150411,1758,21878,277,10.0,,Education,"""Speaker: Dan Callahan

Rust is a new systems programming language from Mozilla that combines strong compile-time correctness guarantees with fast performance... and it plays nice with ctypes! Come learn how you can call Rust functions from Python code and finally say goodbye to hacking C!

Slides can be found at: https://speakerdeck.com/pycon2015 and https://github.com/PyCon/2015-slides""",https://i.ytimg.com/vi/3CwJ0MH-4MA/maxresdefault.jpg,0,False,False,public,https://www.youtube.com/watch?v=3CwJ0MH-4MA,https://www.youtube.com/watch?v=3CwJ0MH-4MA
90,Miriam Lauter - Make your own Smart Air Conditioner - PyCon 2015,https://www.youtube.com/watch?v=MILdMBgxdq8,MILdMBgxdq8,PyCon 2015,@PyCon2015,https://www.youtube.com/@PyCon2015,20150411,1699,854,11,,,Education,,https://i.ytimg.com/vi/MILdMBgxdq8/maxresdefault.jpg,0,False,False,public,https://www.youtube.com/watch?v=MILdMBgxdq8,https://www.youtube.com/watch?v=MILdMBgxdq8
91,"Michelle Fullwood - Grids, Streets and Pipelines: Building a linguistic street map with scikit-learn",https://www.youtube.com/watch?v=MIFOTFdtK2k,MIFOTFdtK2k,PyCon 2015,@PyCon2015,https://www.youtube.com/@PyCon2015,20150411,2091,866,5,2.0,,Education,"""Speaker: Michelle Fullwood

Have you built a classifier in scikit-learn with out-of-the-box features, been disappointed with the results, and wanted to know where to go next? This talk shows how to add your own feature Pipelines and how to tune hyperparameters using GridSearchCV. We'll apply this to the problem of classifying streetnames in Singapore by linguistic origin, and turn the results into a colour-coded street map.

Slides can be found at: https://speakerdeck.com/pycon2015 and https://github.com/PyCon/2015-slides""",https://i.ytimg.com/vi/MIFOTFdtK2k/maxresdefault.jpg,0,False,False,public,https://www.youtube.com/watch?v=MIFOTFdtK2k,https://www.youtube.com/watch?v=MIFOTFdtK2k
92,Katherine Scott - Robots Robots Ra Ra Ra!!! - PyCon 2015,https://www.youtube.com/watch?v=Wf0Uhebn2cM,Wf0Uhebn2cM,PyCon 2015,@PyCon2015,https://www.youtube.com/@PyCon2015,20150411,2502,1556,22,3.0,,Education,"""Speaker: Katherine Scott

Lots of people want to learn more about robotics but are unsure where to start. Turns out there is a python robotics framework, and it runs some of the most sophisticated robots in the world! It is also open source, well-documented, and has a great community. In this talk we will look at Robot Operating System ROS.


Slides can be found at: https://speakerdeck.com/pycon2015 and https://github.com/PyCon/2015-slides""",https://i.ytimg.com/vi/Wf0Uhebn2cM/maxresdefault.jpg,0,False,False,public,https://www.youtube.com/watch?v=Wf0Uhebn2cM,https://www.youtube.com/watch?v=Wf0Uhebn2cM
93,What Python can learn from Erlang,https://www.youtube.com/watch?v=EmICpC_QmhI,EmICpC_QmhI,PyCon 2015,@PyCon2015,https://www.youtube.com/@PyCon2015,20150411,1282,1724,11,1.0,,Education,,https://i.ytimg.com/vi/EmICpC_QmhI/maxresdefault.jpg,0,False,False,public,https://www.youtube.com/watch?v=EmICpC_QmhI,https://www.youtube.com/watch?v=EmICpC_QmhI
94,Chris Waigl - Satellite mapping for everyone  - PyCon 2015,https://www.youtube.com/watch?v=MCHpt1FvblI,MCHpt1FvblI,PyCon 2015,@PyCon2015,https://www.youtube.com/@PyCon2015,20150411,1715,1745,11,,,Education,"""Speaker: Chris Waigl

Concerned about urban sprawl, landscape change or ecosystem recovery? Wildfire, drought or flooding? A vast amount of satellite data, collected since the 1970s, is freely available for your next mapping project. I will demonstrate how Python helps to make sense of odd scientific data and metadata formats and produce beautiful visualization and map products.

Slides can be found at: https://speakerdeck.com/pycon2015 and https://github.com/PyCon/2015-slides""",https://i.ytimg.com/vi/MCHpt1FvblI/maxresdefault.jpg,0,False,False,public,https://www.youtube.com/watch?v=MCHpt1FvblI,https://www.youtube.com/watch?v=MCHpt1FvblI
95,lvh - Distributed Systems 101 - PyCon 2015,https://www.youtube.com/watch?v=YAFGQurdJ3U,YAFGQurdJ3U,PyCon 2015,@PyCon2015,https://www.youtube.com/@PyCon2015,20150411,2725,9762,154,6.0,,Education,"""Speaker: lvh

A very brief introduction to the theory and practice of distributed systems.

Slides can be found at: https://speakerdeck.com/pycon2015 and https://github.com/PyCon/2015-slides""",https://i.ytimg.com/vi/YAFGQurdJ3U/maxresdefault.jpg,0,False,False,public,https://www.youtube.com/watch?v=YAFGQurdJ3U,https://www.youtube.com/watch?v=YAFGQurdJ3U
96,David Beazley - Python Concurrency From the Ground Up: LIVE! - PyCon 2015,https://www.youtube.com/watch?v=MCs5OvhV9S4,MCs5OvhV9S4,PyCon 2015,@PyCon2015,https://www.youtube.com/@PyCon2015,20150411,2809,225154,4522,117.0,,Education,"""Speaker: David Beazley

There are currently three popular approaches to Python concurrency: threads, event loops, and coroutines. Each is shrouded by various degrees of mystery and peril.  In this talk, all three approaches will be deconstructed and explained in a epic ground-up live coding battle.

Slides can be found at: https://speakerdeck.com/pycon2015 and https://github.com/PyCon/2015-slides""",https://i.ytimg.com/vi/MCs5OvhV9S4/maxresdefault.jpg,0,False,False,public,https://www.youtube.com/watch?v=MCs5OvhV9S4,https://www.youtube.com/watch?v=MCs5OvhV9S4
97,David Baumgold - Advanced Git - PyCon 2015,https://www.youtube.com/watch?v=4EOZvow1mk4,4EOZvow1mk4,PyCon 2015,@PyCon2015,https://www.youtube.com/@PyCon2015,20150411,1756,20781,433,15.0,,Education,"Speaker: David Baumgold

You know clone, commit, push, and pull. Now you're ready for the fun stuff. This talk will give you the advanced knowledge you need to take control of your git repository: rebase, cherry-pick, bisect, blame, squashing, and the reflog. You'll also get a better conceptual understanding of how git works, allowing you to chain these tools together to accomplish whatever task you need.

Slides can be found at: https://speakerdeck.com/singingwolfboy/advanced-git",https://i.ytimg.com/vi/4EOZvow1mk4/maxresdefault.jpg,0,False,False,public,https://www.youtube.com/watch?v=4EOZvow1mk4,https://www.youtube.com/watch?v=4EOZvow1mk4
98,Brett Cannon - How to make your code Python 2/3 compatible - PyCon 2015,https://www.youtube.com/watch?v=KPzDX5TX5HE,KPzDX5TX5HE,PyCon 2015,@PyCon2015,https://www.youtube.com/@PyCon2015,20150411,1718,12862,44,,,Education,"""Speaker: Brett Cannon

You know Python 3 is an improvement over Python 2 and you want to use it. Unfortunately you have legacy Python 2 source code that needs to stay compatible. But don't fret! This talk will show you that you can make your code be Python 2/3 source-compatible using various tools to pick up the nitty-gritty work and help modernize your Python code to newer Python 2 practices.

Slides can be found at: https://speakerdeck.com/pycon2015 and https://github.com/PyCon/2015-slides""",https://i.ytimg.com/vi/KPzDX5TX5HE/maxresdefault.jpg,0,False,False,public,https://www.youtube.com/watch?v=KPzDX5TX5HE,https://www.youtube.com/watch?v=KPzDX5TX5HE
