index,title,url,video_id,uploader,uploader_id,uploader_url,upload_date,duration,view_count,like_count,comment_count,tags,categories,description,thumbnail,age_limit,is_live,was_live,availability,webpage_url,original_url
93,Jay Goel - Better Integration Testing with Cucumber - PyCon 2016,https://www.youtube.com/watch?v=ZEZBZFi_e88,ZEZBZFi_e88,PyCon 2016,@PyCon2016,https://www.youtube.com/@PyCon2016,20160531,1550,4832,52.0,,,People & Blogs,"Speaker: Jay Goel

One of the hardest questions to answer is """"does my program help the user accomplish their goals?"""" Whether that person is using our website or a programmer using our library, this talk will describe how to write automated tests which map to tasks our users are trying to accomplish. We will demonstrate specific Python testing libraries and evaluate the pros and cons of this approach to testing.

Slides can be found at: https://speakerdeck.com/pycon2016 and https://github.com/PyCon/2016-slides",https://i.ytimg.com/vi_webp/ZEZBZFi_e88/maxresdefault.webp,0,False,False,public,https://www.youtube.com/watch?v=ZEZBZFi_e88,https://www.youtube.com/watch?v=ZEZBZFi_e88
94,"Ana Balica - To mock, or not to mock, that is the question - PyCon 2016",https://www.youtube.com/watch?v=KYG5C1CEkOk,KYG5C1CEkOk,PyCon 2016,@PyCon2016,https://www.youtube.com/@PyCon2016,20160531,1718,6121,110.0,2.0,,People & Blogs,"Speaker: Ana Balica

Mocking is a very powerful testing concept that has some dangerous pitfalls. There are obvious use cases where mocks are an absolute requirement to be able to test a part of the app. Nevertheless sometimes apparently useful mocks can yield erroneous test results. This talk goes into deeper detail on the trade-off of using mocks in testing.

Slides can be found at: https://speakerdeck.com/pycon2016 and https://github.com/PyCon/2016-slides",https://i.ytimg.com/vi_webp/KYG5C1CEkOk/maxresdefault.webp,0,False,False,public,https://www.youtube.com/watch?v=KYG5C1CEkOk,https://www.youtube.com/watch?v=KYG5C1CEkOk
95,Mike Graham - The Life Cycle of a Python Class - PyCon 2016,https://www.youtube.com/watch?v=kZtC_4Ecq1Y,kZtC_4Ecq1Y,PyCon 2016,@PyCon2016,https://www.youtube.com/@PyCon2016,20160531,2244,6144,45.0,3.0,,People & Blogs,"Speaker: Mike Graham

And end-to-end look at the life and death of a class and its instance.

Slides can be found at: https://speakerdeck.com/pycon2016 and https://github.com/PyCon/2016-slides",https://i.ytimg.com/vi_webp/kZtC_4Ecq1Y/maxresdefault.webp,0,False,False,public,https://www.youtube.com/watch?v=kZtC_4Ecq1Y,https://www.youtube.com/watch?v=kZtC_4Ecq1Y
96,Thomas Ballinger - Finding closure with closures - PyCon 2016,https://www.youtube.com/watch?v=E9wS6LdXM8Y,E9wS6LdXM8Y,PyCon 2016,@PyCon2016,https://www.youtube.com/@PyCon2016,20160531,1866,6553,117.0,7.0,,People & Blogs,"Speaker: Thomas Ballinger

What are closures all about anyway, and why is there a new keyword in Python
3?
We'll look at what a closure is, their history in the Python language, what
the Python 3 nonlocal keyword is about, and examine how closures are
idiomatically used (and avoided) in Python.

Slides can be found at: https://speakerdeck.com/pycon2016 and https://github.com/PyCon/2016-slides",https://i.ytimg.com/vi_webp/E9wS6LdXM8Y/maxresdefault.webp,0,False,False,public,https://www.youtube.com/watch?v=E9wS6LdXM8Y,https://www.youtube.com/watch?v=E9wS6LdXM8Y
97,Nicholas Tollervey - Education Summit wrap-up: teaching Python — how hard can it be? - PyCon 2016,https://www.youtube.com/watch?v=33aSGoPhh7c,33aSGoPhh7c,PyCon 2016,@PyCon2016,https://www.youtube.com/@PyCon2016,20160531,1565,456,4.0,1.0,,People & Blogs,"Speaker: Nicholas Tollervey

If you teach, if you Python — join us for a whirlwind tour of this year's Python Education Summit.

Slides can be found at: https://speakerdeck.com/pycon2016 and https://github.com/PyCon/2016-slides",https://i.ytimg.com/vi_webp/33aSGoPhh7c/maxresdefault.webp,0,False,False,public,https://www.youtube.com/watch?v=33aSGoPhh7c,https://www.youtube.com/watch?v=33aSGoPhh7c
98,Cory Benfield - Building Protocol Libraries The Right Way - PyCon 2016,https://www.youtube.com/watch?v=7cC3_jGwl_U,7cC3_jGwl_U,PyCon 2016,@PyCon2016,https://www.youtube.com/@PyCon2016,20160531,1897,13878,290.0,7.0,,People & Blogs,"Speaker: Cory Benfield

One of the great strengths of the Python ecosystem is the enormous collection of powerful, flexible libraries. However, these libraries tend to suffer from one extremely common design flaw that mean that the work done is not easily re-usable or transferable. In this talk, we talk about how to build libraries that can be used as widely as possible, through the lens of the Python Hyper HTTP project.

Slides can be found at: https://speakerdeck.com/pycon2016 and https://github.com/PyCon/2016-slides",https://i.ytimg.com/vi_webp/7cC3_jGwl_U/maxresdefault.webp,0,False,False,public,https://www.youtube.com/watch?v=7cC3_jGwl_U,https://www.youtube.com/watch?v=7cC3_jGwl_U
99,Andrew Godwin - Reinventing Django for the Real-Time Web - PyCon 2016,https://www.youtube.com/watch?v=2sEPipctTxw,2sEPipctTxw,PyCon 2016,@PyCon2016,https://www.youtube.com/@PyCon2016,20160531,2685,26874,451.0,19.0,,People & Blogs,"Speaker: Andrew Godwin

Django has long been tied to the request-response pattern, but the upcoming """"channels"""" project changes this and allows Django to natively support WebSockets, running tasks after responses, easily handle long-polling and more. Come and learn about the design, how we're trying to keep things as Django-like as possible, and how you can use it in your projects.

Slides can be found at: https://speakerdeck.com/pycon2016 and https://github.com/PyCon/2016-slides",https://i.ytimg.com/vi_webp/2sEPipctTxw/maxresdefault.webp,0,False,False,public,https://www.youtube.com/watch?v=2sEPipctTxw,https://www.youtube.com/watch?v=2sEPipctTxw
100,Dorian Pula - Pythons in A Container - Lessons Learned Dockerizing Python Micro-Services,https://www.youtube.com/watch?v=qT0dQ8S7jOg,qT0dQ8S7jOg,PyCon 2016,@PyCon2016,https://www.youtube.com/@PyCon2016,20160531,1826,9486,124.0,,,People & Blogs,"Speaker: Dorian Pula

Micro-services and Docker are all the rage for developing scalable systems.  But what challenges will you face when developing and deploying Python apps using Docker to production? This talk goes into the real-life lessons learned from creating, deploying and scaling Dockerized Python applications. 

Slides can be found at: https://speakerdeck.com/pycon2016 and https://github.com/PyCon/2016-slides",https://i.ytimg.com/vi_webp/qT0dQ8S7jOg/maxresdefault.webp,0,False,False,public,https://www.youtube.com/watch?v=qT0dQ8S7jOg,https://www.youtube.com/watch?v=qT0dQ8S7jOg
101,"Alex Gaynor - The cobbler's children have no shoes, or building better tools for ourselves",https://www.youtube.com/watch?v=gRFHvavxnos,gRFHvavxnos,PyCon 2016,@PyCon2016,https://www.youtube.com/@PyCon2016,20160531,1791,3213,45.0,2.0,,People & Blogs,"Speaker: Alex Gaynor

As developers, we make programs which do things. But we don't build nearly enough programs to make our own jobs easier. Once, not all that long ago, we didn't even have continuous integration servers. This talk will go through what types of new specialized tools we, as developers, can and should be building to make our jobs better.

Slides can be found at: https://speakerdeck.com/pycon2016 and https://github.com/PyCon/2016-slides",https://i.ytimg.com/vi_webp/gRFHvavxnos/maxresdefault.webp,0,False,False,public,https://www.youtube.com/watch?v=gRFHvavxnos,https://www.youtube.com/watch?v=gRFHvavxnos
102,"Kate Heddleston, Joyce Jang - Usable Ops: How to make web infrastructure management easier.",https://www.youtube.com/watch?v=4pFs5ZquZcc,4pFs5ZquZcc,PyCon 2016,@PyCon2016,https://www.youtube.com/@PyCon2016,20160531,2467,947,9.0,,,People & Blogs,"Speakers: Kate Heddleston, Joyce Jang

As developer tools increase in power, the systems we’re able to build do too. However, with great power comes great...complexity, and the systems we build today are more complex than ever before. This talk is about reducing the complexity of your web infrastructure, and making it easier for developers on your team to learn, use, and manage your infrastructure.

Slides can be found at: https://speakerdeck.com/pycon2016 and https://github.com/PyCon/2016-slides",https://i.ytimg.com/vi_webp/4pFs5ZquZcc/maxresdefault.webp,0,False,False,public,https://www.youtube.com/watch?v=4pFs5ZquZcc,https://www.youtube.com/watch?v=4pFs5ZquZcc
103,Łukasz Langa - Thinking In Coroutines - PyCon 2016,https://www.youtube.com/watch?v=l4Nn-y9ktd4,l4Nn-y9ktd4,PyCon 2016,@PyCon2016,https://www.youtube.com/@PyCon2016,20160530,1638,19028,283.0,6.0,,People & Blogs,"Speaker: Łukasz Langa

The wait for the killer feature of Python 3 is over! Come learn about asyncio and the beauty of event loops, coroutines, futures, executors and the mighty async/await. Practical examples. Bad puns. Pretty pictures. No prior asyncore, Twisted or Node.js experience required.

Slides can be found at: https://speakerdeck.com/pycon2016 and https://github.com/PyCon/2016-slides",https://i.ytimg.com/vi_webp/l4Nn-y9ktd4/maxresdefault.webp,0,False,False,public,https://www.youtube.com/watch?v=l4Nn-y9ktd4,https://www.youtube.com/watch?v=l4Nn-y9ktd4
104,Paul Ross - Here be Dragons - Writing Safe C Extensions - PyCon 2016,https://www.youtube.com/watch?v=Yq__HtUIH5Y,Yq__HtUIH5Y,PyCon 2016,@PyCon2016,https://www.youtube.com/@PyCon2016,20160530,1714,2880,59.0,3.0,,People & Blogs,"Speaker: Paul Ross

Writing Python Extensions can be daunting. This talk de-mystifies what you need to know to write reliable and blazingly fast Pythonic C code.

Slides can be found at: https://speakerdeck.com/pycon2016 and https://github.com/PyCon/2016-slides",https://i.ytimg.com/vi_webp/Yq__HtUIH5Y/maxresdefault.webp,0,False,False,public,https://www.youtube.com/watch?v=Yq__HtUIH5Y,https://www.youtube.com/watch?v=Yq__HtUIH5Y
105,Kavya Joshi - A tale of concurrency through creativity in Python: a deep dive into how gevent works.,https://www.youtube.com/watch?v=GunMToxbE0E,GunMToxbE0E,PyCon 2016,@PyCon2016,https://www.youtube.com/@PyCon2016,20160530,1809,14713,403.0,19.0,,People & Blogs,"Speaker: Kavya Joshi

gevent is an open source Python library for asynchronous I/O. It provides a powerful construct to build concurrent applications; think threads, except lightweight and cooperatively scheduled. We will delve into how gevent is architected from its building blocks — sophisticated coroutines, an event loop, and a dash of creativity to neatly integrate them.

Slides can be found at: https://speakerdeck.com/pycon2016 and https://github.com/PyCon/2016-slides",https://i.ytimg.com/vi_webp/GunMToxbE0E/maxresdefault.webp,0,False,False,public,https://www.youtube.com/watch?v=GunMToxbE0E,https://www.youtube.com/watch?v=GunMToxbE0E
106,"Christian Heimes - File descriptors, Unix sockets and other POSIX wizardry - PyCon 2016",https://www.youtube.com/watch?v=Ftg8fjY_YWU,Ftg8fjY_YWU,PyCon 2016,@PyCon2016,https://www.youtube.com/@PyCon2016,20160530,1921,29672,575.0,11.0,,People & Blogs,"Speaker: Christian Heimes

Have you ever wondered how the OS manages open files and network connections, what this 'file descriptor' thing actually is all about, or what's so special about Unix sockets? In my talk I will give you a quick tour into the I/O layer and process model of Unix-like operating systems. You will learn how to securely identify and efficiently share resources between processes.

Slides can be found at: https://speakerdeck.com/pycon2016 and https://github.com/PyCon/2016-slides",https://i.ytimg.com/vi_webp/Ftg8fjY_YWU/maxresdefault.webp,0,False,False,public,https://www.youtube.com/watch?v=Ftg8fjY_YWU,https://www.youtube.com/watch?v=Ftg8fjY_YWU
107,"Brett Cannon, Dino Viehland - Pyjion: who doesn’t want faster for free? - PyCon 2016",https://www.youtube.com/watch?v=1DAIzO3QXcA,1DAIzO3QXcA,PyCon 2016,@PyCon2016,https://www.youtube.com/@PyCon2016,20160530,1555,2443,23.0,,,People & Blogs,"Speakers: Brett Cannon, Dino Viehland

 At PyCon US 2015 an experiment was started: could a JIT be added to CPython which would speed up performance **and** be fully backwards-compatible? Could unaltered extension modules live happily with a JIT? That experiment is Pyjion and this talk will explain what we changed to CPython to add a pre-existing JIT to it and whether we met our goal of being a benefit instead of a hindrance.

Slides can be found at: https://speakerdeck.com/pycon2016 and https://github.com/PyCon/2016-slides",https://i.ytimg.com/vi_webp/1DAIzO3QXcA/maxresdefault.webp,0,False,False,public,https://www.youtube.com/watch?v=1DAIzO3QXcA,https://www.youtube.com/watch?v=1DAIzO3QXcA
108,Karen Rubin - Building a Quantitative Trading Strategy To Beat the S&P500 - PyCon 2016,https://www.youtube.com/watch?v=ll6Tq-wTXXw,ll6Tq-wTXXw,PyCon 2016,@PyCon2016,https://www.youtube.com/@PyCon2016,20160530,2789,9873,114.0,5.0,,People & Blogs,"Speaker: Karen Rubin

Two years ago, Karen embarked on a project to learn how to research, write and trade algorithms to invest in the market. She re-learned python and explored what would happen if you invested in women-led companies over a 12-year period. In this talk, she will walk through the highs and lows of her journey from initial data gathering, through writing a strategy to validation and trading.

Slides can be found at: https://speakerdeck.com/pycon2016 and https://github.com/PyCon/2016-slides",https://i.ytimg.com/vi_webp/ll6Tq-wTXXw/maxresdefault.webp,0,False,False,public,https://www.youtube.com/watch?v=ll6Tq-wTXXw,https://www.youtube.com/watch?v=ll6Tq-wTXXw
109,"Ying Li, David Lawrence - When the going gets tough, get TUF going - PyCon 2016",https://www.youtube.com/watch?v=fDvO9jwXCV4,fDvO9jwXCV4,PyCon 2016,@PyCon2016,https://www.youtube.com/@PyCon2016,20160530,1627,870,9.0,,,People & Blogs,"Speakers: Ying Li, David Lawrence

The Update Framework (TUF) helps developers secure new or existing software update systems by providing integrity and freshness guarantees over package distribution. Integrate TUF into your deployment pipelines to provide integrity and version guarantees for build and deployment artifacts.

Slides can be found at: https://speakerdeck.com/pycon2016 and https://github.com/PyCon/2016-slides",https://i.ytimg.com/vi_webp/fDvO9jwXCV4/maxresdefault.webp,0,False,False,public,https://www.youtube.com/watch?v=fDvO9jwXCV4,https://www.youtube.com/watch?v=fDvO9jwXCV4
110,Guillermo Pérez - Python as a configuration language - PyCon 2016,https://www.youtube.com/watch?v=cLWUD9VnLmA,cLWUD9VnLmA,PyCon 2016,@PyCon2016,https://www.youtube.com/@PyCon2016,20160530,1829,1446,6.0,1.0,,People & Blogs,"Speaker: Guillermo Pérez

The enormous size of Facebook's infrastructure and its """"Move Fast"""" culture pose a challenge for the configuration framework, requiring a safe, fast and usable system to deploy settings to hundreds of thousands of servers.

Python plays a special role in this framework, being the tool for generating the configuration, paired with thrift for enhanced schema validation and type-safety.

Slides can be found at: https://speakerdeck.com/pycon2016 and https://github.com/PyCon/2016-slides",https://i.ytimg.com/vi_webp/cLWUD9VnLmA/maxresdefault.webp,0,False,False,public,https://www.youtube.com/watch?v=cLWUD9VnLmA,https://www.youtube.com/watch?v=cLWUD9VnLmA
111,"Drew Fisher - Designing secure systems with Object-Capabilities, Python, and Cap'n Proto",https://www.youtube.com/watch?v=OS94twkD74s,OS94twkD74s,PyCon 2016,@PyCon2016,https://www.youtube.com/@PyCon2016,20160530,1667,2111,23.0,3.0,,People & Blogs,"Speaker: Drew Fisher

Object-capability security is a technique for designing systems that lets us apply object-oriented design principles to security policies, reducing cognitive overhead and risk of errors that lead to vulnerabilities.  In this talk, I'll explain capabilities, how they work, and what cool things they make possible for your systems, with real-world examples from sandstorm.io.

Slides can be found at: https://speakerdeck.com/pycon2016 and https://github.com/PyCon/2016-slides",https://i.ytimg.com/vi_webp/OS94twkD74s/maxresdefault.webp,0,False,False,public,https://www.youtube.com/watch?v=OS94twkD74s,https://www.youtube.com/watch?v=OS94twkD74s
112,Kelsey Gilmore-Innis - Seriously Strong Security on a Shoestring (CW) - PyCon 2016,https://www.youtube.com/watch?v=8FeNdXzVLEs,8FeNdXzVLEs,PyCon 2016,@PyCon2016,https://www.youtube.com/@PyCon2016,20160530,1580,1354,11.0,,,People & Blogs,"Speaker: Kelsey Gilmore-Innis

Are you confident your Python webapp is secure? Really confident? Hand-it-over-to-a-team-of-expert-haxx0rs-to-tear-into confident? Find out how, without any formal security background, we successfully built a site storing some of the most sensitive data imaginable that passed a formal security audit from the best in the business. Content warning: this talk includes discussion of sexual assault.

Slides can be found at: https://speakerdeck.com/pycon2016 and https://github.com/PyCon/2016-slides",https://i.ytimg.com/vi_webp/8FeNdXzVLEs/maxresdefault.webp,0,False,False,public,https://www.youtube.com/watch?v=8FeNdXzVLEs,https://www.youtube.com/watch?v=8FeNdXzVLEs
113,Clara Bennett - Git: A Peek Under the Hood - PyCon 2016,https://www.youtube.com/watch?v=zZ2hG6PMjk8,zZ2hG6PMjk8,PyCon 2016,@PyCon2016,https://www.youtube.com/@PyCon2016,20160530,1474,3953,58.0,4.0,,People & Blogs,"Speaker: Clara Bennett

Git is a powerful source control tool, but the learning curve can be steep. This talk introduces the underpinnings of git, to provide a foundation for more confident and effective git use. My hypothesis is that having a solid mental model of what git is actually doing under the hood helps you more easily learn to use advanced git features.

Slides can be found at: https://speakerdeck.com/pycon2016 and https://github.com/PyCon/2016-slides",https://i.ytimg.com/vi_webp/zZ2hG6PMjk8/maxresdefault.webp,0,False,False,public,https://www.youtube.com/watch?v=zZ2hG6PMjk8,https://www.youtube.com/watch?v=zZ2hG6PMjk8
114,Juozas Kaziukėnas - Building An Interpreter In RPython - PyCon 2016,https://www.youtube.com/watch?v=9tDpjzPLvNY,9tDpjzPLvNY,PyCon 2016,@PyCon2016,https://www.youtube.com/@PyCon2016,20160530,2584,1709,20.0,,,People & Blogs,"Speaker: Juozas Kaziukėnas

To understand how dynamic programming languages get executed I set out to build a PHP interpreter. Not a joke, I really did it and it worked! The final result was a well-tested piece of Python code, which could be compiled to be very performant as well. 

The goal of this talk is to introduce you to the basics of interpreters and the tools available in RPython to build one.

Slides can be found at: https://speakerdeck.com/pycon2016 and https://github.com/PyCon/2016-slides",https://i.ytimg.com/vi_webp/9tDpjzPLvNY/maxresdefault.webp,0,False,False,public,https://www.youtube.com/watch?v=9tDpjzPLvNY,https://www.youtube.com/watch?v=9tDpjzPLvNY
115,Lorena Barba - Keynote - PyCon 2016,https://www.youtube.com/watch?v=ckW1xuGVpug,ckW1xuGVpug,PyCon 2016,@PyCon2016,https://www.youtube.com/@PyCon2016,20160530,4330,3953,26.0,4.0,,People & Blogs,"Speaker: Lorena Barba

Keynote

Slides can be found at: https://speakerdeck.com/pycon2016 and https://github.com/PyCon/2016-slides",https://i.ytimg.com/vi_webp/ckW1xuGVpug/maxresdefault.webp,0,False,False,public,https://www.youtube.com/watch?v=ckW1xuGVpug,https://www.youtube.com/watch?v=ckW1xuGVpug
116,"Deploying and scaling applications with Docker, Swarm, and a tiny bit of Python magic - PyCon 2016",https://www.youtube.com/watch?v=GpHMTR7P2Ms,GpHMTR7P2Ms,PyCon 2016,@PyCon2016,https://www.youtube.com/@PyCon2016,20160530,11466,9553,83.0,3.0,,People & Blogs,"Speaker: Jérôme Petazzoni

Docker is an open platform to build, ship, and run any application, anywhere. In this hands-on tutorial, you will learn advanced Docker concepts, and see how to deploy and scale applications using Docker Swarm clustering abilities and reusable, customizable Python tooling.


Slides can be found at: https://speakerdeck.com/pycon2016 and https://github.com/PyCon/2016-slides",https://i.ytimg.com/vi_webp/GpHMTR7P2Ms/maxresdefault.webp,0,False,False,public,https://www.youtube.com/watch?v=GpHMTR7P2Ms,https://www.youtube.com/watch?v=GpHMTR7P2Ms
117,Stuart Williams - Python Epiphanies - PyCon 2016,https://www.youtube.com/watch?v=6inqFd1bUkE,6inqFd1bUkE,PyCon 2016,@PyCon2016,https://www.youtube.com/@PyCon2016,20160530,10189,3492,20.0,4.0,,People & Blogs,"Speaker: Stuart Williams

This tutorial is for developers who've been using Python for a while and would consider themselves at an intermediate level, but are looking for a deeper understanding of the language.  It focuses on how Python differs from other languages in subtle but important ways that are often confusing, and it demystifies a number of language features that are sometimes misunderstood.

Slides can be found at: https://speakerdeck.com/pycon2016 and https://github.com/PyCon/2016-slides",https://i.ytimg.com/vi/6inqFd1bUkE/maxresdefault.jpg,0,False,False,public,https://www.youtube.com/watch?v=6inqFd1bUkE,https://www.youtube.com/watch?v=6inqFd1bUkE
118,Allen Downey - Computational Statistics - PyCon 2016,https://www.youtube.com/watch?v=VR52vSbHBAk,VR52vSbHBAk,PyCon 2016,@PyCon2016,https://www.youtube.com/@PyCon2016,20160530,8959,9208,76.0,5.0,,People & Blogs,"Speaker: Allen Downey

Statistical inference is a fundamental tool in science and engineering, but it is often poorly understood.  This tutorial uses computational methods, including Monte Carlo simulation and resampling, to explore estimation, hypothesis testing and statistical modeling.  Attendees will develop understanding of statistical concepts and learn to use real data to answer relevant questions.

Slides can be found at: https://speakerdeck.com/pycon2016 and https://github.com/PyCon/2016-slides",https://i.ytimg.com/vi_webp/VR52vSbHBAk/maxresdefault.webp,0,False,False,public,https://www.youtube.com/watch?v=VR52vSbHBAk,https://www.youtube.com/watch?v=VR52vSbHBAk
119,Christophe Pettus - PostgreSQL Proficiency for Python People - PyCon 2016,https://www.youtube.com/watch?v=knUitQQnpJo,knUitQQnpJo,PyCon 2016,@PyCon2016,https://www.youtube.com/@PyCon2016,20160530,10806,7773,92.0,2.0,,People & Blogs,"Speaker: Christophe Pettus

PostgreSQL has become the default database for most green-field development projects, and is the data storage architecture behind many major Python-based success stories, such as Instagram. Despite a reputation as being complex and fiddly, Postgres is easy to install, administer, maintain, and use... with just a little bit of orientation. This is that orientation.

Slides can be found at: https://speakerdeck.com/pycon2016 and https://github.com/PyCon/2016-slides",https://i.ytimg.com/vi_webp/knUitQQnpJo/maxresdefault.webp,0,False,False,public,https://www.youtube.com/watch?v=knUitQQnpJo,https://www.youtube.com/watch?v=knUitQQnpJo
120,Tyler Reddy - Computational Geometry in Python - PyCon 2016,https://www.youtube.com/watch?v=nb3GRgtjlTw,nb3GRgtjlTw,PyCon 2016,@PyCon2016,https://www.youtube.com/@PyCon2016,20160530,9291,7618,99.0,1.0,,People & Blogs,"Speaker: Tyler Reddy

Computational geometry deals with the algorithms used to solve a diverse set of problems in geometry. Applications range from robotics (visibility) and geographic information systems to game development (collision detection) and medical research. This tutorial will introduce computational geometry, the related tools available in the Python ecosystem, and identify areas for improvement.

Slides can be found at: https://speakerdeck.com/pycon2016 and https://github.com/PyCon/2016-slides",https://i.ytimg.com/vi/nb3GRgtjlTw/maxresdefault.jpg,0,False,False,public,https://www.youtube.com/watch?v=nb3GRgtjlTw,https://www.youtube.com/watch?v=nb3GRgtjlTw
121,Sev Leonard - The Fellowship of the Data - PyCon 2016,https://www.youtube.com/watch?v=n4VLLQXF_9Y,n4VLLQXF_9Y,PyCon 2016,@PyCon2016,https://www.youtube.com/@PyCon2016,20160530,6733,1327,3.0,,,People & Blogs,"Speaker: Sev Leonard

Python is an excellent tool for gathering, organizing, and storing data. This tutorial will cover efficient & scalable methods for performing these activities as part of an automated data pipeline, enabling attendees to build the One Data Pipeline To Rule Them All.

Slides can be found at: https://speakerdeck.com/pycon2016 and https://github.com/PyCon/2016-slides",https://i.ytimg.com/vi_webp/n4VLLQXF_9Y/maxresdefault.webp,0,False,False,public,https://www.youtube.com/watch?v=n4VLLQXF_9Y,https://www.youtube.com/watch?v=n4VLLQXF_9Y
122,Mike McKerns - Efficient Python for High-Performance Parallel Computing - PyCon 2016,https://www.youtube.com/watch?v=6zQhUlMYea4,6zQhUlMYea4,PyCon 2016,@PyCon2016,https://www.youtube.com/@PyCon2016,20160530,11345,7094,40.0,4.0,,People & Blogs,"Speaker: Mike McKerns

This tutorial is targeted at the intermediate-to-advanced Python user who wants to extend Python into High-Performance Computing. The tutorial will provide hands-on examples and essential performance tips every developer should know for writing effective parallel Python. The result will be a clear sense of possibilities and best practices using Python in HPC environments.

Slides can be found at: https://speakerdeck.com/pycon2016 and https://github.com/PyCon/2016-slides",https://i.ytimg.com/vi_webp/6zQhUlMYea4/maxresdefault.webp,0,False,False,public,https://www.youtube.com/watch?v=6zQhUlMYea4,https://www.youtube.com/watch?v=6zQhUlMYea4
