index,title,url,video_id,uploader,uploader_id,uploader_url,upload_date,duration,view_count,like_count,comment_count,tags,categories,description,thumbnail,age_limit,is_live,was_live,availability,webpage_url,original_url
1,PyCon Latam. Mensaje comité organizador,https://www.youtube.com/watch?v=Vw-4kwa4Khg,Vw-4kwa4Khg,PyCon Latam,@pyconlatam3804,https://www.youtube.com/@pyconlatam3804,20201002,59,273,15,,,Education,Los invitamos a ver el material preparado para 2020,https://i.ytimg.com/vi/Vw-4kwa4Khg/sddefault.jpg,0,False,False,public,https://www.youtube.com/watch?v=Vw-4kwa4Khg,https://www.youtube.com/watch?v=Vw-4kwa4Khg
2,PyCon Latam. Entrevista con Tania Allard,https://www.youtube.com/watch?v=BajgzKsHBU8,BajgzKsHBU8,PyCon Latam,@pyconlatam3804,https://www.youtube.com/@pyconlatam3804,20201002,2532,115,8,,,Education,Contamos con la presencia de Tania Allard quien participo como Keynote en/durante PyCon Latam 2019!,https://i.ytimg.com/vi/BajgzKsHBU8/sddefault.jpg,0,False,False,public,https://www.youtube.com/watch?v=BajgzKsHBU8,https://www.youtube.com/watch?v=BajgzKsHBU8
3,PyCon Latam. Entrevista con Lorena Mesa,https://www.youtube.com/watch?v=X6qYsyCUACA,X6qYsyCUACA,PyCon Latam,@pyconlatam3804,https://www.youtube.com/@pyconlatam3804,20201002,1028,107,8,,,Education,Tenemos la presencia de Lorena Mesa quien participo como Keynote en/durante PyCon Latam 2019!,https://i.ytimg.com/vi/X6qYsyCUACA/sddefault.jpg,0,False,False,public,https://www.youtube.com/watch?v=X6qYsyCUACA,https://www.youtube.com/watch?v=X6qYsyCUACA
4,PyCon Latam. Entrevista con Álvaro Justen,https://www.youtube.com/watch?v=QxjTc_QcL1s,QxjTc_QcL1s,PyCon Latam,@pyconlatam3804,https://www.youtube.com/@pyconlatam3804,20201002,1607,73,9,,,Education,Contamos con la presencia de Álvaro Justen quien participo como Keynote en/durante PyCon Latam 2019!,https://i.ytimg.com/vi/QxjTc_QcL1s/sddefault.jpg,0,False,False,public,https://www.youtube.com/watch?v=QxjTc_QcL1s,https://www.youtube.com/watch?v=QxjTc_QcL1s
5,PyCon Latam. Entrevista con Carol Willing,https://www.youtube.com/watch?v=KMPsy2SO0M4,KMPsy2SO0M4,PyCon Latam,@pyconlatam3804,https://www.youtube.com/@pyconlatam3804,20201002,2179,64,5,,,Education,Tenemos una entrevista con Carol Willing y tenemos el gusto de anunciar su participación como Keynote durante la edición de PyCon Latam 2021!!,https://i.ytimg.com/vi/KMPsy2SO0M4/sddefault.jpg,0,False,False,public,https://www.youtube.com/watch?v=KMPsy2SO0M4,https://www.youtube.com/watch?v=KMPsy2SO0M4
6,PyCon Latam. Entrevista con Sergio Sánchez,https://www.youtube.com/watch?v=PVliND_o58c,PVliND_o58c,PyCon Latam,@pyconlatam3804,https://www.youtube.com/@pyconlatam3804,20201002,2372,182,11,,,Education,"Tenemos una entrevista con Sergio Sánchez, fundador de Tacos de Datos, y tenemos el gusto de anunciar su participación como Keynote durante la edición de PyCon Latam 2021!!",https://i.ytimg.com/vi/PVliND_o58c/sddefault.jpg,0,False,False,public,https://www.youtube.com/watch?v=PVliND_o58c,https://www.youtube.com/watch?v=PVliND_o58c
7,PyCon Latam. Entrevista con Froilán Irizarry,https://www.youtube.com/watch?v=aLS3mfN_llM,aLS3mfN_llM,PyCon Latam,@pyconlatam3804,https://www.youtube.com/@pyconlatam3804,20201002,1711,79,6,,,Education,Tenemos una entrevista con Froilán Irizarry y tenemos el gusto de anunciar su participación como Keynote durante la edición de PyCon Latam 2021!!,https://i.ytimg.com/vi/aLS3mfN_llM/sddefault.jpg,0,False,False,public,https://www.youtube.com/watch?v=aLS3mfN_llM,https://www.youtube.com/watch?v=aLS3mfN_llM
8,PyCon Latam. Entrevista con Luciano Ramalho,https://www.youtube.com/watch?v=EC98HDMSR8Q,EC98HDMSR8Q,PyCon Latam,@pyconlatam3804,https://www.youtube.com/@pyconlatam3804,20201002,2427,121,7,,,Education,Tenemos una entrevista con Luciano Ramalho y tenemos el gusto de anunciar su participación como Keynote durante la edición de PyCon Latam 2021!!,https://i.ytimg.com/vi/EC98HDMSR8Q/sddefault.jpg,0,False,False,public,https://www.youtube.com/watch?v=EC98HDMSR8Q,https://www.youtube.com/watch?v=EC98HDMSR8Q
