index,title,url,video_id,uploader,uploader_id,uploader_url,upload_date,duration,view_count,like_count,comment_count,tags,categories,description,thumbnail,age_limit,is_live,was_live,availability,webpage_url,original_url
21,"Analýza freelance trhu. Trendy, štatistiky a prehľad v IT projektoch - Michal Brandis",https://www.youtube.com/watch?v=OIf5O_6T1Q4,OIf5O_6T1Q4,PyCon SK,@pyconsk,https://www.youtube.com/@pyconsk,20240405,2667,54,2,,,Science & Technology,"Všimli ste si, ako často recruiteri nerozumejú IT? Nevedia vám poriadne vysvetliť, akú pracovnú pozíciu ponúkajú, spätná väzba po pohovore sa postupne stáva sci-fi fenoménom a keď už sa vám konečne podarí získať nový projekt, mnohí z vás zaň nedostanú ani férové finančné ohodnotenie? Alebo vám klienti dokonca nezaplatia včas?

Pred takmer jedenástimi rokmi sa dvaja ostrieľaní ajťáci rozhodli vydláždiť pre IT špecialistov novú cestu, ktorá by sa odlišovala osobným a odborne fundovaným prístupom. Tú si do dnešného dňa zvolilo viac ako 29-tisíc freelancerov, od konzultantov cez programátorov, testerov, analytikov až po manažérov, ktorí získavajú špičkové projekty. Dá sa povedať, že značka TITANS ovládla trh outsourcingu IT špecialistov na Slovensku.

Prieskumy uvádzajú, že IT oddelenia rozširuje čoraz menej úspešných firiem. Efektívnejší je pre ne dynamický prenájom tímu. Predstavím vám dôvody, pre ktoré toľkí ajťáci prechádzajú na breh freelancingu a faktory, ktoré vám pomôžu zistiť, či je to pre vás vhodná cesta. Dozviete sa viac o vývoji trhu, odvetviach s najväčším množstvom projektov, finančnom ohodnotení a tiež o špecializáciách, ktoré sú najžiadanejšie na IT projektoch. Na záver vám priblížim rozličné formy spolupráce s klientmi, priemerný čas, ktorí naši Titani strávia na projektoch, a praktický rozdiel medzi živnosťou a sro-čkou.

https://2024.pycon.sk/sk/speakers/michal-brandis.html",https://i.ytimg.com/vi/OIf5O_6T1Q4/maxresdefault.jpg,0,False,False,public,https://www.youtube.com/watch?v=OIf5O_6T1Q4,https://www.youtube.com/watch?v=OIf5O_6T1Q4
22,Knižnica Numba alebo ako zrýchliť Python? - Rudolf Starovský,https://www.youtube.com/watch?v=UCDb6BDTCR0,UCDb6BDTCR0,PyCon SK,@pyconsk,https://www.youtube.com/@pyconsk,20240405,2251,53,1,,,Science & Technology,"Programovací jazyk Python nepatrí z pohľadu výkonnosti medzi najrýchlejšie programovacie jazyky. Ak chceme zrýchliť naše výpočty v jazyku Python, môže nám pomôcť knižnica Numba, vďaka ktorej môžeme dosiahnuť výkonnosť podobnú kompilovaným jazykom C alebo C++.

V prednáške vysvetlíme ako funguje Python interpreter a čo je Just in time kompilácia. Pozrieme sa aké možnosti ponúka knižnica Numba a na konkrétnych príkladoch uvedieme ako vieme zrýchliť Python kód.

https://2024.pycon.sk/sk/speakers/rudolf-starovsk%C3%BD.html",https://i.ytimg.com/vi/UCDb6BDTCR0/maxresdefault.jpg,0,False,False,public,https://www.youtube.com/watch?v=UCDb6BDTCR0,https://www.youtube.com/watch?v=UCDb6BDTCR0
23,Azure OpenAI for Python developers in enterprise organizations - Štěpán Bechynský,https://www.youtube.com/watch?v=VGK-XPv_6JI,VGK-XPv_6JI,PyCon SK,@pyconsk,https://www.youtube.com/@pyconsk,20240405,2312,51,2,,,Science & Technology,"You will see how to use OpenAI in enterprise organizations. How to deploy GPT model just for your organization, how to protect it from public internet access and how to work with Python OpenAI SDK.

https://2024.pycon.sk/sk/speakers/%C5%A1t%C4%9Bp%C3%A1n-bechynsk%C3%BD.html",https://i.ytimg.com/vi/VGK-XPv_6JI/maxresdefault.jpg,0,False,False,public,https://www.youtube.com/watch?v=VGK-XPv_6JI,https://www.youtube.com/watch?v=VGK-XPv_6JI
24,Data Engineering Story - Peter Steiner,https://www.youtube.com/watch?v=1yUt5NGwPoI,1yUt5NGwPoI,PyCon SK,@pyconsk,https://www.youtube.com/@pyconsk,20240405,2473,51,0,,,Science & Technology,"From Data Engineering at Takeda to Revolutionizing Real Estate Search: A Journey of Innovation and Impact.

Join me on an inspiring journey that traces my evolution from a Data Engineer at Takeda to the founder of a successful real estate search startup ""Realitymap.sk"" with a thriving user base. In this presentation, I will share key milestones, challenges, and lessons learned during my transformational experience in the world of data engineering.

We'll delve into the intricacies of my work at Takeda, where I honed my skills in data processing, integration, and analysis. Discover how these foundational experiences laid the groundwork for my entrepreneurial venture into the real estate tech landscape.

The narrative will unfold as I navigate the dynamic landscape of data, engineering, and entrepreneurship. Learn about the pivotal moments that shaped my approach to problem-solving, innovation, and collaboration, ultimately leading to the creation of Realitymap.sk that has captured the attention of thousands of users.

https://2024.pycon.sk/sk/speakers/peter-steiner.html",https://i.ytimg.com/vi/1yUt5NGwPoI/maxresdefault.jpg,0,False,False,public,https://www.youtube.com/watch?v=1yUt5NGwPoI,https://www.youtube.com/watch?v=1yUt5NGwPoI
25,Data science education: The story of Data Science Academy - Jakub Hantabal a Laura Johanesová,https://www.youtube.com/watch?v=SKrM_BpNdcE,SKrM_BpNdcE,PyCon SK,@pyconsk,https://www.youtube.com/@pyconsk,20240405,2345,43,2,,,Science & Technology,"Taking the first step in learning data science in Python can be challenging. To help people overcome this fear, we co-founded Data Science Academy - an NGO providing accessible data science education focused on building a collaborative community of data enthusiasts. Over the past year, we organized two week-long bootcamps Winter Data School and Summer Data School, as well as five shorter workshops, where we show the magic of Python and inspire people to continue their programming journey.

In this talk, we will share our story of how we set up Data Science Academy, what we do, and how we motivate people to take up data science. We will discuss why quality education and focus of attendees require a physical presence of multiple lecturers, and how to make transition to Python straightforward by drawing parallels with Excel and selecting the key concepts to explain. Lastly, we will demonstrate our unique teaching materials utilizing Jupyter Notebook, and how we use them in our workshops, and how participants on our events used them to advance their careers and set up new collaborations.

https://2024.pycon.sk/sk/speakers/jakub-hantabal-a-laura-johanesov%C3%A1.html",https://i.ytimg.com/vi/SKrM_BpNdcE/maxresdefault.jpg,0,False,False,public,https://www.youtube.com/watch?v=SKrM_BpNdcE,https://www.youtube.com/watch?v=SKrM_BpNdcE
26,Solving Two Hard Problems in Computer Science Using Pandas - Miroslav Šedivý,https://www.youtube.com/watch?v=0ellcRYU2-U,0ellcRYU2-U,PyCon SK,@pyconsk,https://www.youtube.com/@pyconsk,20240405,1749,43,1,,,Science & Technology,"There are 2 hard problems in computer science: cache invalidation, naming things, and off-by-1 errors. -- Leon Bambrick

When working with timeseries representing the production data of power plants, the fundamental step is to define a good data structure. The shape of the dataframes must be a good balance between speed and memory usage to work with the right and up-to-date amount of data (cache invalidation). The parameters must have good names for fast and unambiguous identification (naming things). The time intervals must be the correct fit for observed physics to prevent mismatches (off-by-1 errors).

I'll show you a few Python tricks and my experience with how I solved these problems in my projects.

https://2024.pycon.sk/sk/speakers/miroslav-%C5%A1ediv%C3%BD.html",https://i.ytimg.com/vi/0ellcRYU2-U/maxresdefault.jpg,0,False,False,public,https://www.youtube.com/watch?v=0ellcRYU2-U,https://www.youtube.com/watch?v=0ellcRYU2-U
27,The Beauty of Sinus And Cosinus: Hypotrochoid Curves as a Web App - Vojta Filipec,https://www.youtube.com/watch?v=zR2q_wvg4ro,zR2q_wvg4ro,PyCon SK,@pyconsk,https://www.youtube.com/@pyconsk,20240405,2088,38,0,,,Science & Technology,"This is a talk of a data scientist who loves to play with math, enjoys creating visualisations in Jupyter Notebook but has limited capabilities of sharing his notebooks online. I will explain what hypotrochoid curves are, how to plot them in Jupyter Notebook, then how remake a notebook into an interactive in-browser app (using ipython widgets and voila), and finally how to publish this app via Binder. I hope this will be useful for anyone who wants to share his/her notebooks with broad audience.

https://2024.pycon.sk/sk/speakers/vojta-filipec.html",https://i.ytimg.com/vi/zR2q_wvg4ro/maxresdefault.jpg,0,False,False,public,https://www.youtube.com/watch?v=zR2q_wvg4ro,https://www.youtube.com/watch?v=zR2q_wvg4ro
28,Pythonic Outliers: Mastering LOF Detection - Peter Bakonyi,https://www.youtube.com/watch?v=rx1-8o7Q6fI,rx1-8o7Q6fI,PyCon SK,@pyconsk,https://www.youtube.com/@pyconsk,20240405,2000,37,0,,,Science & Technology,"Join us for an insightful talk that delves into the fundamentals of leveraging the Local Outlier Factor (LOF) algorithm in Python for anomaly detection.

Anomalies, or outliers, in datasets can hold crucial information yet often remain elusive without proper tools. This presentation aims to demystify the concept of LOF and equip attendees with the knowledge to effectively identify and interpret local outliers in their own datasets.

The talk will commence with a brief overview of the theoretical underpinnings of LOF, shedding light on its ability to detect anomalies by comparing the local density of data points. We will explore the nuances of LOF, emphasizing its capacity to capture anomalies that might be overlooked by traditional methods.

We'll provide an overview of the steps involved and share practical insights into integrating LOF into data analysis workflows.

The talk will conclude by outlining considerations for parameter tuning and interpreting LOF results, providing attendees with a foundational understanding of how to apply LOF effectively in their data exploration endeavors.

By the end of the talk, attendees will have a solid understanding of the basics of LOF, its significance in anomaly detection, and the proficiency to apply this algorithm in Python. Whether you are a beginner seeking an introduction to outlier detection or an experienced practitioner looking to enhance your toolkit, this presentation promises to be a valuable exploration into the realm of local outlier factors.

https://2024.pycon.sk/sk/speakers/peter-bakonyi.html",https://i.ytimg.com/vi/rx1-8o7Q6fI/maxresdefault.jpg,0,False,False,public,https://www.youtube.com/watch?v=rx1-8o7Q6fI,https://www.youtube.com/watch?v=rx1-8o7Q6fI
29,Lightning talks - Saturday,https://www.youtube.com/watch?v=jRaxeRxA6wo,jRaxeRxA6wo,PyCon SK,@pyconsk,https://www.youtube.com/@pyconsk,20240405,4131,26,0,,,Science & Technology,,https://i.ytimg.com/vi/jRaxeRxA6wo/maxresdefault.jpg,0,False,False,public,https://www.youtube.com/watch?v=jRaxeRxA6wo,https://www.youtube.com/watch?v=jRaxeRxA6wo
30,How to not get crazy from information overload - Veronika Kabátová,https://www.youtube.com/watch?v=Dcx0F0vibKw,Dcx0F0vibKw,PyCon SK,@pyconsk,https://www.youtube.com/@pyconsk,20240405,1854,26,0,,,Science & Technology,"There's too many pieces of advice out there to keep them in mind and actually remember to apply them when it matters. It's tempting to become a genius overnight as the competition is harsh. But trying to become perfect and keep every piece of information in mind is overwhelming and stressful.

Where's the line between what's realistic, both as a beginner and as experienced programmer? What are some good habits to adopt right away, and how do they relate to your typical programming memes?

We'll take a look at some behaviors even experienced IT folks struggle with and how to do things instead and why, to get you a head start in your new journey.

https://2024.pycon.sk/sk/speakers/veronika-kab%C3%A1tov%C3%A1.html",https://i.ytimg.com/vi/Dcx0F0vibKw/maxresdefault.jpg,0,False,False,public,https://www.youtube.com/watch?v=Dcx0F0vibKw,https://www.youtube.com/watch?v=Dcx0F0vibKw
31,Lightning talks - Friday,https://www.youtube.com/watch?v=uUPiMb-5xlc,uUPiMb-5xlc,PyCon SK,@pyconsk,https://www.youtube.com/@pyconsk,20240405,1812,25,0,,,Science & Technology,,https://i.ytimg.com/vi/uUPiMb-5xlc/maxresdefault.jpg,0,False,False,public,https://www.youtube.com/watch?v=uUPiMb-5xlc,https://www.youtube.com/watch?v=uUPiMb-5xlc
