index,title,url,video_id,uploader,uploader_id,uploader_url,upload_date,duration,view_count,like_count,comment_count,tags,categories,description,thumbnail,age_limit,is_live,was_live,availability,webpage_url,original_url
30,Bhagyashree Padalkar: How Fedora uses Python data analytics to understand and help the community,https://www.youtube.com/watch?v=tY05tRpJhgw,tY05tRpJhgw,PyCon CZ,@PyConCZ,https://www.youtube.com/@PyConCZ,20170109,1148,126,1,,,Science & Technology,"I have been involved with Fedora Community Operations Team from its conception one year ago. Amongst other things we at CommOps are trying to build tools to understand the community and make it more contributor-friendly. While newcomer onboarding is important for any FOSS community, retaining them is critical. We have been working on improving the contributor retention rates in Fedora Community for a while now. In this direction, we have built some Python-based scripts to understand the activity of Fedora contributors and their life cycles. We have also tried to analyze contribution activity of some successful contributors and find common patterns in their behavior and have tried to measure the impact of attending FOSS events on the activity of a contributor and on the Fedora community as a whole. All this work has been done using Python and during this talk, I want to share details about the tools we have built, how we built them and the insights we have generated from them.",https://i.ytimg.com/vi_webp/tY05tRpJhgw/maxresdefault.webp,0,False,False,public,https://www.youtube.com/watch?v=tY05tRpJhgw,https://www.youtube.com/watch?v=tY05tRpJhgw
31,"Honza Klusáček: TMOU, puzzlehunts & cracking (im)possible problems with Python",https://www.youtube.com/watch?v=uY5y4TrpWds,uY5y4TrpWds,PyCon CZ,@PyConCZ,https://www.youtube.com/@PyConCZ,20170109,1054,107,1,,,Science & Technology,"Do you like codes, riddles and ciphers? Some people have turned cracking puzzles into a hobby and gave rise to events dedicated to solving such problems – puzzlehunts. TMOU is the oldest and biggest one among them. During these games, players regularly feel the frustration from endless unsuccessful efforts, often quickly followed by extraordinary joy after finally figuring out the peculiar problem. This joy can only be surpassed by creating a perfect puzzle for others to solve.

I will share a few lessons learnt while organizing TMOU, namely:
- What makes a problem seemingly impossible
- How to turn impossible into possible and hard into not-so-hard
- How to crack tough problems and hammer down their complexity
- Why Python might be a good hammer for that

Follow the creation of a specific puzzle from an initial idea to the final design (puzzle #4 ""the Dice"", TMOU 17 http://www.tmou.cz/2015/sifry/reseni#kostka). Where else would you need to solve a bunch of problems just to create a new one?",https://i.ytimg.com/vi_webp/uY5y4TrpWds/maxresdefault.webp,0,False,False,public,https://www.youtube.com/watch?v=uY5y4TrpWds,https://www.youtube.com/watch?v=uY5y4TrpWds
32,Jachym Cepicky: What is the price of open source?,https://www.youtube.com/watch?v=FCeHmed1mIs,FCeHmed1mIs,PyCon CZ,@PyConCZ,https://www.youtube.com/@PyConCZ,20170109,1817,103,1,,,Science & Technology,"We keep hearing, that ""open source if for free, so why don't you use it?"" But is that really true? What are the real costs of open source software? Where does the money come from? How do the developers make their living? Is it really as free as a beer? How to bring money to open source software development? Is open source the one and only greatest and only good and best possible development model?",https://i.ytimg.com/vi_webp/FCeHmed1mIs/maxresdefault.webp,0,False,False,public,https://www.youtube.com/watch?v=FCeHmed1mIs,https://www.youtube.com/watch?v=FCeHmed1mIs
33,Szymon Matejczyk: API first and forgotten,https://www.youtube.com/watch?v=xVF7eJ2limg,xVF7eJ2limg,PyCon CZ,@PyConCZ,https://www.youtube.com/@PyConCZ,20170109,1987,102,2,,,People & Blogs,"""API first"" principle seems convincing. Anyone who tried implementing it realizes that often the problem is not to design or formally specify the API (with Swagger or other tool). The problem is to keep the specification, servers and clients consistent and easy to maintain for longer. I will talk about what practices you need to remember and which tools are worth to check.

The talk will start with the basics of microservices architecture. I will describe some mistakes we have made that turned our microservices architecture fragile and unmanageable. 
I will show how we redesigned our API using Swagger and what principles you should have in mind when doing so. I will also cover technical problems we encountered:
* how to test that a service implements an API;
* how to avoid writing validation that is already specified in the swagger file;
* how to create clients and stub and who should maintain them.

As theory is not enough here, I will also show some tools that help, describe in detail connexion library and show how we used it to implement microservices integration tests @Growbots.",https://i.ytimg.com/vi_webp/xVF7eJ2limg/maxresdefault.webp,0,False,False,public,https://www.youtube.com/watch?v=xVF7eJ2limg,https://www.youtube.com/watch?v=xVF7eJ2limg
34,Marek Grac: Turn off the computer,https://www.youtube.com/watch?v=wfttvTPvZRo,wfttvTPvZRo,PyCon CZ,@PyConCZ,https://www.youtube.com/@PyConCZ,20170109,1850,97,0,,,Science & Technology,Fence agents are drivers written in Python that help you to remove a misbehaving computer node from cluster or cloud. This project started in 2006 and it was written in bash/perl/C. And after 5000+ commits we have a Python/C project. What happened in the last ten years? And how maintainable is such project?,https://i.ytimg.com/vi_webp/wfttvTPvZRo/maxresdefault.webp,0,False,False,public,https://www.youtube.com/watch?v=wfttvTPvZRo,https://www.youtube.com/watch?v=wfttvTPvZRo
35,Jan Pospíšil: PyIoT,https://www.youtube.com/watch?v=FyeCIRdNRVY,FyeCIRdNRVY,PyCon CZ,@PyConCZ,https://www.youtube.com/@PyConCZ,20170109,1850,96,0,,,Science & Technology,"Python + ESP8266 + Cloud = automate anything.
Introduction of Python friendly IoT HW + Cloud (Azure) services",https://i.ytimg.com/vi_webp/FyeCIRdNRVY/maxresdefault.webp,0,False,False,public,https://www.youtube.com/watch?v=FyeCIRdNRVY,https://www.youtube.com/watch?v=FyeCIRdNRVY
36,Petr Hodina: Porting embedded projects,https://www.youtube.com/watch?v=8XiHPgVIbwk,8XiHPgVIbwk,PyCon CZ,@PyConCZ,https://www.youtube.com/@PyConCZ,20170109,1378,90,0,,,Science & Technology,"Have you ever worked on embedded project? Chances are that you had to use some proprietary IDE for development. Wouldn't it be better to use some open source IDE like Eclipse or QtCreator? What should I do when I'm working a project and can't start from the scratch? 

In this presentation I'll show you how Python can help you with porting projects. I'll give examples of projects developed in IAR Embedded Workbench and Keil uVision. At the end we'll have CMake build file which can be imported to many IDEs.

Python modules like Objectify and Jinja will be a great help to us!",https://i.ytimg.com/vi_webp/8XiHPgVIbwk/maxresdefault.webp,0,False,False,public,https://www.youtube.com/watch?v=8XiHPgVIbwk,https://www.youtube.com/watch?v=8XiHPgVIbwk
37,Miloň Krejča: Compute and optimize!,https://www.youtube.com/watch?v=ZEqmeeM_HVQ,ZEqmeeM_HVQ,PyCon CZ,@PyConCZ,https://www.youtube.com/@PyConCZ,20170109,2122,87,0,,,Science & Technology,"Time, it's function in life and computing and what might be possible to build in the near future. Lazy solutions to computation and beyond, how to get nearly maximum from your computer without too much work. Use of Numpy, Pandas, Cython, multiprocessing, deap, Ta-Lib libraries and genetic programming in a quest to solve some financial markets.",https://i.ytimg.com/vi_webp/ZEqmeeM_HVQ/maxresdefault.webp,0,False,False,public,https://www.youtube.com/watch?v=ZEqmeeM_HVQ,https://www.youtube.com/watch?v=ZEqmeeM_HVQ
38,Dariusz Aniszewski: DOS yourself a.k.a. Load Testing,https://www.youtube.com/watch?v=pvhNxmWsUrg,pvhNxmWsUrg,PyCon CZ,@PyConCZ,https://www.youtube.com/@PyConCZ,20170109,1793,84,0,,,People & Blogs,"In my talk I'd like to tell you about testing performance of your backend applications. I'll explain what load testing is in theory and how to do it in practise. I'd like to focus on why load testing is important step in software development and what will most likely happen when it's forgotten. I'll walk through different tools that can be used, starting with very basic AB, via jMeter up to the Locust and cloud-based services.",https://i.ytimg.com/vi_webp/pvhNxmWsUrg/maxresdefault.webp,0,False,False,public,https://www.youtube.com/watch?v=pvhNxmWsUrg,https://www.youtube.com/watch?v=pvhNxmWsUrg
39,"Richard Kellner: ChatOps, have you ever heard about it?",https://www.youtube.com/watch?v=od7Y_daoBEA,od7Y_daoBEA,PyCon CZ,@PyConCZ,https://www.youtube.com/@PyConCZ,20170109,2169,84,0,,,Science & Technology,"ChatOps is a term for a collaborative way of running DevOps, including operating aspects of systems and infrastructure through an online chat. It combines a powerful way to get things done with a more human way of working.

But it doesn’t happen overnight. In this talk I would like to explain various stages of adoption. I also want to inspire you to implement ChatOps into your workflow and to suggest ideas how to do that. I will show you why Python is the ideal language for building a ChatOps stack. It is quick and fun to build new chat commands and even a person who doesn’t know Python can easily start learning and see the results immediately.",https://i.ytimg.com/vi_webp/od7Y_daoBEA/maxresdefault.webp,0,False,False,public,https://www.youtube.com/watch?v=od7Y_daoBEA,https://www.youtube.com/watch?v=od7Y_daoBEA
40,Benny Daon: The Great Fork,https://www.youtube.com/watch?v=2f6bhR62J8Q,2f6bhR62J8Q,PyCon CZ,@PyConCZ,https://www.youtube.com/@PyConCZ,20170110,2158,68,0,,,Science & Technology,"Python is more than a language, it's also a knowledge base of PEPs and meta-PEPs driving Python's growth. Join me as I dive into PEP purpose and guidelines, explore notable proposals and try to make sense of it all.",https://i.ytimg.com/vi_webp/2f6bhR62J8Q/maxresdefault.webp,0,False,False,public,https://www.youtube.com/watch?v=2f6bhR62J8Q,https://www.youtube.com/watch?v=2f6bhR62J8Q
