index,title,url,video_id,uploader,uploader_id,uploader_url,upload_date,duration,view_count,like_count,comment_count,tags,categories,description,thumbnail,age_limit,is_live,was_live,availability,webpage_url,original_url
1,Ingrid Nagyová: Jak začít programovat v Pythonu tvorbou jednoduchých her,https://www.youtube.com/watch?v=Z0fYdW7CowU,Z0fYdW7CowU,PyCon CZ,@PyConCZ,https://www.youtube.com/@PyConCZ,20170109,1519,18671,152,10.0,,Science & Technology,"Mnoho, zejména mladých lidí, přivádí k programování touha vytvořit hru. Tato touha může být zmařena při nahlédnutí do učebnic programování, které poznatky budují systematicky a pro začátečníka mnohdy nepochopitelně.
Přednáška ukazuje, jak lze začít tvořit a hrát si s jednoduchými grafickými objekty bez znalostí programování. Společně definujeme několik grafických objektů, které rozpohybujeme po grafickém plátně a jednoduchým zachycením událostí z klávesnice zabezpečíme možnost interaktivního ovládání hry.",https://i.ytimg.com/vi_webp/Z0fYdW7CowU/maxresdefault.webp,0,False,False,public,https://www.youtube.com/watch?v=Z0fYdW7CowU,https://www.youtube.com/watch?v=Z0fYdW7CowU
2,Viliam Križan: Peewee: A Simple Yet Powerful ORM,https://www.youtube.com/watch?v=AjQXHWupoG0,AjQXHWupoG0,PyCon CZ,@PyConCZ,https://www.youtube.com/@PyConCZ,20170109,1540,4120,55,6.0,,Science & Technology,"Peewee is a small, expressive ORM, written as a single Python module. In my talk, I will present usage examples including advanced queries, transactions, and backend switching. We will look at differences between Peewee and SQLAlchemy, see how Peewee takes advantage of operators to build SELECT queries, learn how to integrate Peewee into a Flask-based application, and cover the most common difficulties when trying to extend Peewee.",https://i.ytimg.com/vi_webp/AjQXHWupoG0/maxresdefault.webp,0,False,False,public,https://www.youtube.com/watch?v=AjQXHWupoG0,https://www.youtube.com/watch?v=AjQXHWupoG0
3,Vita Smid: Algorithmic trading with asyncio,https://www.youtube.com/watch?v=9qt0SSGOqzU,9qt0SSGOqzU,PyCon CZ,@PyConCZ,https://www.youtube.com/@PyConCZ,20170109,2106,3265,40,2.0,,Science & Technology,"My team and I have been building a Python 3 stock trading platform for the past 2.5 years. We are powering a trading fund that runs a range of manual and automated strategies. This is a story of what we have learned about Asyncio, profiling, optimization, debugging, and operations... in a fast-moving environment where bugs actually cost money.",https://i.ytimg.com/vi_webp/9qt0SSGOqzU/maxresdefault.webp,0,False,False,public,https://www.youtube.com/watch?v=9qt0SSGOqzU,https://www.youtube.com/watch?v=9qt0SSGOqzU
4,Katharine Jarmul: Introduction to Data Wrangling with Python,https://www.youtube.com/watch?v=4KnKXoJibBU,4KnKXoJibBU,PyCon CZ,@PyConCZ,https://www.youtube.com/@PyConCZ,20170109,2006,2978,42,3.0,,Science & Technology,"Become a data wrangler with Python! This talk will introduce you to the core concepts of data analysis with Python. We’ll cover libraries that allow you to easily clean and set up your initial dataset, importing data from all different file types and standards. We’ll introduce some basic libraries to help with statistics and analysis and then cover how to document and explore your findings.

It’s assumed you have a working understanding of Python and its data types and structures, and that you’ve used and understand Python for basic scripting. It’s also assumed you haven’t done much in terms of data analysis, and you’d like to learn more. If this is you, welcome!",https://i.ytimg.com/vi_webp/4KnKXoJibBU/maxresdefault.webp,0,False,False,public,https://www.youtube.com/watch?v=4KnKXoJibBU,https://www.youtube.com/watch?v=4KnKXoJibBU
5,Jozef Kepesi: Our journey from developers to real software engineers,https://www.youtube.com/watch?v=ReVqWlTSMJo,ReVqWlTSMJo,PyCon CZ,@PyConCZ,https://www.youtube.com/@PyConCZ,20170109,1396,2369,24,2.0,,Science & Technology,"Few years ago, we were a bunch of cowboys trying to create the fastest flight ticket search engine. We did a lot of mistakes... But we did it with passion. I will talk about how we knew how to avoid all the stupid issues, but why were we not able to do it at the same time.",https://i.ytimg.com/vi/ReVqWlTSMJo/maxresdefault.jpg,0,False,False,public,https://www.youtube.com/watch?v=ReVqWlTSMJo,https://www.youtube.com/watch?v=ReVqWlTSMJo
6,Goga Patarkatsishvili: Similarities and standards between modern web frameworks,https://www.youtube.com/watch?v=8ohAYzU3V8g,8ohAYzU3V8g,PyCon CZ,@PyConCZ,https://www.youtube.com/@PyConCZ,20170109,993,1892,209,,,Science & Technology,"In the past years there have appeared a lot of new frameworks and libraries in the modern web world, but behind the scenes there are a lot of similarities and standards in any language and I will talk about these standards. 

I also have a post about it: 
https://medium.com/@ent1c3d/similarities-between-django-and-laravel-eb5e2b344ecb",https://i.ytimg.com/vi/8ohAYzU3V8g/maxresdefault.jpg,0,False,False,public,https://www.youtube.com/watch?v=8ohAYzU3V8g,https://www.youtube.com/watch?v=8ohAYzU3V8g
7,Ana Balica: Humanizing among coders,https://www.youtube.com/watch?v=npyB5Oz-v-I,npyB5Oz-v-I,PyCon CZ,@PyConCZ,https://www.youtube.com/@PyConCZ,20170109,2476,1195,26,6.0,,Science & Technology,"What makes a good developer? Certainly technical expertise, insightfulness, creativity, thoughtfulness. What about daily social interactions with other developers inside the company and community? Those are never easy. Even though we all try to be nice to each other, sometimes unintentionally we can be a bit off. I'd like to share with you some stories that helped me rationalize some of my own communication and human interaction mistakes and how I'm trying to correct them.",https://i.ytimg.com/vi/npyB5Oz-v-I/maxresdefault.jpg,0,False,False,public,https://www.youtube.com/watch?v=npyB5Oz-v-I,https://www.youtube.com/watch?v=npyB5Oz-v-I
8,Jan Škrle: AsyncIO Connections: Coroutines (Streams) vs Callbacks (Protocols),https://www.youtube.com/watch?v=2nk25Nmz858,2nk25Nmz858,PyCon CZ,@PyConCZ,https://www.youtube.com/@PyConCZ,20170110,1862,908,4,1.0,,Science & Technology,"Standard Python library Asyncio offers both, coroutines and callbacks, APIs for setting up client or server connections. Let's briefly present both APIs with examples and go through ups and downs of each solution.",https://i.ytimg.com/vi_webp/2nk25Nmz858/maxresdefault.webp,0,False,False,public,https://www.youtube.com/watch?v=2nk25Nmz858,https://www.youtube.com/watch?v=2nk25Nmz858
9,Stanislav Kontár: Python GUI programming for command-line geeks (and others as well),https://www.youtube.com/watch?v=ydBj0Pn4SfM,ydBj0Pn4SfM,PyCon CZ,@PyConCZ,https://www.youtube.com/@PyConCZ,20170109,1879,899,7,,,Science & Technology,"GUI programming in Python for beginners. We will discuss basic GUI building blocks and some traditional choices of GUI libraries along with their advantages, disadvantages, and portability. We will look at some code examples and discuss related topics ranging from basics, such as handling long running tasks, to more advanced, OpenGL integration and deploying.",https://i.ytimg.com/vi_webp/ydBj0Pn4SfM/maxresdefault.webp,0,False,False,public,https://www.youtube.com/watch?v=ydBj0Pn4SfM,https://www.youtube.com/watch?v=ydBj0Pn4SfM
10,Pavol Rusnak: MicroPython,https://www.youtube.com/watch?v=7ZF0yuBT2Jw,7ZF0yuBT2Jw,PyCon CZ,@PyConCZ,https://www.youtube.com/@PyConCZ,20170109,1796,848,12,,,Science & Technology,"MicroPython je moderní implementace Pythonu pro mikrokontrolery a embedded systémy. Pojďme se spolu podívat, čím se liší od ""velkého"" Pythonu a co všechno se dá použitím MicroPythonu ovládat. Součastí přednášky budou praktické ukázky na různých zařízeních.",https://i.ytimg.com/vi/7ZF0yuBT2Jw/maxresdefault.jpg,0,False,False,public,https://www.youtube.com/watch?v=7ZF0yuBT2Jw,https://www.youtube.com/watch?v=7ZF0yuBT2Jw
11,Amador Pahim: Automated Testing Framework,https://www.youtube.com/watch?v=eTR-LvW80pM,eTR-LvW80pM,PyCon CZ,@PyConCZ,https://www.youtube.com/@PyConCZ,20170109,1579,822,4,4.0,,People & Blogs,"Avocado is a next generation testing framework inspired by Autotest and modern development tools such as git. One can call it a test framework with benefits. Native tests are written in Python and they follow the unit test pattern, but any executable can serve as a test.
In this presentation we will cover the Avocado architecture, main features, demonstrations and we will also compare Avocado with some known test runners.",https://i.ytimg.com/vi_webp/eTR-LvW80pM/maxresdefault.webp,0,False,False,public,https://www.youtube.com/watch?v=eTR-LvW80pM,https://www.youtube.com/watch?v=eTR-LvW80pM
12,Valdemar Švábenský: From (Python) zero to hero: How beginner university students learn programming,https://www.youtube.com/watch?v=IDmCB8spRC4,IDmCB8spRC4,PyCon CZ,@PyConCZ,https://www.youtube.com/@PyConCZ,20170109,1679,757,10,,,Science & Technology,"Are you curious about how to teach programming effectively? Are you a Python fan interested in everything Python-related? Or would you simply like to see a non-standard presentation? If you answered yes at least once, then this funny and inspiring talk is right for you! In less than 20 minutes, you'll hear from a young student-teacher about:
- What coding skills are taught to beginners and how
- Experience with teaching
- A few surprises
No technical knowledge is needed (some code samples will be shown, but they're not essential). Discussion at the end is welcome. Looking forward to seeing you!",https://i.ytimg.com/vi_webp/IDmCB8spRC4/maxresdefault.webp,0,False,False,public,https://www.youtube.com/watch?v=IDmCB8spRC4,https://www.youtube.com/watch?v=IDmCB8spRC4
13,Petr Joachim: Running Python in production,https://www.youtube.com/watch?v=_fzQmB_A3K8,_fzQmB_A3K8,PyCon CZ,@PyConCZ,https://www.youtube.com/@PyConCZ,20170109,1364,742,4,,,Science & Technology,"Exploring many ways of running Python in different production environments. 

Starting from ordinary self-hosted old-school etc. scripts, through supervisor, ending with docker. All of this with great examples.",https://i.ytimg.com/vi_webp/_fzQmB_A3K8/maxresdefault.webp,0,False,False,public,https://www.youtube.com/watch?v=_fzQmB_A3K8,https://www.youtube.com/watch?v=_fzQmB_A3K8
14,Robert Kuska: Feed your code to coala,https://www.youtube.com/watch?v=CIMoAFMgCMw,CIMoAFMgCMw,PyCon CZ,@PyConCZ,https://www.youtube.com/@PyConCZ,20170109,1281,566,6,1.0,,People & Blogs,"Feed your code to coala
So you already use linters for your codebase but it still feels like it's not enough. You want to check for more things, and better, use your own checkers but you want it to be as easy as possible! Meet coala.io, it feeds on your code and makes it better at the same time. With (almost*) no cost.

* CPU consumption not included",https://i.ytimg.com/vi_webp/CIMoAFMgCMw/maxresdefault.webp,0,False,False,public,https://www.youtube.com/watch?v=CIMoAFMgCMw,https://www.youtube.com/watch?v=CIMoAFMgCMw
15,Pavel Grochal: Streamparse - introduction to real-time data processing with Python (and some Java),https://www.youtube.com/watch?v=9VHB68v2L6w,9VHB68v2L6w,PyCon CZ,@PyConCZ,https://www.youtube.com/@PyConCZ,20170109,1917,539,2,,,Science & Technology,"This talk will be about getting started with Streamparse, which is the Python ""connection"" to Apache Storm, a real-time processing framework.

Besides the basic introduction, the talk will also include some practical examples and major gotchas what we've encountered while developing in streamparse.",https://i.ytimg.com/vi_webp/9VHB68v2L6w/maxresdefault.webp,0,False,False,public,https://www.youtube.com/watch?v=9VHB68v2L6w,https://www.youtube.com/watch?v=9VHB68v2L6w
16,Magdaléna Kabátová: Testing of Web Applications Using Python,https://www.youtube.com/watch?v=3YekbncInhU,3YekbncInhU,PyCon CZ,@PyConCZ,https://www.youtube.com/@PyConCZ,20170109,1966,448,4,,,People & Blogs,"In the continuous integration development process, automatic testing is critical. The application must be delivered properly to customers and users. And with frequent releases, manual testing is exhausting.
Therefore developers need integration and system tests, aside from basic unit tests - to make sure their commits are integrated properly and did not break anything. No more: one hotfix creates two new bugs!

For beginners: I will give a brief introduction to software testing and its types and talk about how easy is to start with writing automatic tests in Python.

For advanced: I will present integration testing of Cleerio web mapping application (originally written in JavaScript and PHP) using Python together with Selenium project.",https://i.ytimg.com/vi_webp/3YekbncInhU/maxresdefault.webp,0,False,False,public,https://www.youtube.com/watch?v=3YekbncInhU,https://www.youtube.com/watch?v=3YekbncInhU
17,Tomáš Bedřich: C:\keep/calm/and\use\pathlib,https://www.youtube.com/watch?v=prCvSxriSJw,prCvSxriSJw,PyCon CZ,@PyConCZ,https://www.youtube.com/@PyConCZ,20170109,1365,383,2,3.0,,People & Blogs,"C:\keep/calm/and\use\pathlib
How do you handle filesystem paths? Strings and os.path.join()? Seriously? Come to learn something shiny for everyday use!",https://i.ytimg.com/vi_webp/prCvSxriSJw/maxresdefault.webp,0,False,False,public,https://www.youtube.com/watch?v=prCvSxriSJw,https://www.youtube.com/watch?v=prCvSxriSJw
18,Katharine Jarmul: DAGs & Dask: How & When to Accelerate Your Data Analysis,https://www.youtube.com/watch?v=gRRocTAtZm8,gRRocTAtZm8,PyCon CZ,@PyConCZ,https://www.youtube.com/@PyConCZ,20170109,1889,365,3,,,Science & Technology,"This talk will introduce the audience to the Dask library for data analysis, focusing on when Dask is useful (and when you might be better off simply using SQL or Pandas). We will cover how to build and analyze directed acyclic graphs using Dask and how to easily set up a cluster running Dask for your data wrangling needs.",https://i.ytimg.com/vi_webp/gRRocTAtZm8/maxresdefault.webp,0,False,False,public,https://www.youtube.com/watch?v=gRRocTAtZm8,https://www.youtube.com/watch?v=gRRocTAtZm8
19,Andrej Mosat: Python embedded in your daily life,https://www.youtube.com/watch?v=Ez1FT029BHY,Ez1FT029BHY,PyCon CZ,@PyConCZ,https://www.youtube.com/@PyConCZ,20170110,2110,347,4,1.0,,Science & Technology,"Have you always wondered where the batteries from Python: batteries included are? Despair no more! We come with battery-powered Python devices for your daily life.
We will focus on showcasing and live demonstration of Python running on very small microprocessors. 
First, an overview of existing platforms which can run Python on batteries. Then we will showcase in a live demo what Python can do for you. Finally a “how to” workflow for successful Python coding on low power ARM Cortex microprocessors will be revealed to get you started.",https://i.ytimg.com/vi_webp/Ez1FT029BHY/maxresdefault.webp,0,False,False,public,https://www.youtube.com/watch?v=Ez1FT029BHY,https://www.youtube.com/watch?v=Ez1FT029BHY
20,Jacek Kolodziej: GIL: What's the hassle and why should I care?,https://www.youtube.com/watch?v=ZvWmAIODi-s,ZvWmAIODi-s,PyCon CZ,@PyConCZ,https://www.youtube.com/@PyConCZ,20170109,2193,298,4,,,Science & Technology,"Demistifying GIL - what's that, how it really affects performance, what changed in the last few years and what can we do about GIL in everyday programming.

There is still a lot of misunderstanding regarding GIL, coming from not-so-perfect documentation - not explaining the implications thoroughly and in a simple way; it's also often outdated.

Also, GIL's implementation changed a little in CPython 3.x that may affect programmers' choices.

This misinformation may, in some cases, drive them away from CPython where it's not really the worst choice. By providing comprehensive guide to today's GIL in CPython, this presentation aims to help make better design choices - be it choosing a concurrency/parallelism model, Python implementation to use or even whether or not to drop Python entirely.

There have been (and still are), of course, attempts to get rid of GIL and find another solution for the problem it solves - newest of which is Larry Hasting's project called GILectomy, which I hope to shed some light on.",https://i.ytimg.com/vi_webp/ZvWmAIODi-s/maxresdefault.webp,0,False,False,public,https://www.youtube.com/watch?v=ZvWmAIODi-s,https://www.youtube.com/watch?v=ZvWmAIODi-s
21,Wojtek Erbetowski: Agile used to be really cool,https://www.youtube.com/watch?v=GkiCxUrXZ98,GkiCxUrXZ98,PyCon CZ,@PyConCZ,https://www.youtube.com/@PyConCZ,20170109,1735,264,0,,,Science & Technology,"Agile software development used to be really cool back in the 00's. The vision of old school waterfall projects, with months of work before integrating and releasing software to users gives me the creeps. But let's return to the present. I can hardly even recall working in a non-agile project. I feel that most of the Agile manifesto principles are in my DNA more than a thing to follow. If you want to keep growing in this industry you might want to start building on top of that. This presentation contains my experience about aligning people, sharing a direction, and how servant leadership works.",https://i.ytimg.com/vi_webp/GkiCxUrXZ98/maxresdefault.webp,0,False,False,public,https://www.youtube.com/watch?v=GkiCxUrXZ98,https://www.youtube.com/watch?v=GkiCxUrXZ98
22,Anton Marchukov: Do You Want to Retry? Handling Network Failures,https://www.youtube.com/watch?v=bqe8EztTV7k,bqe8EztTV7k,PyCon CZ,@PyConCZ,https://www.youtube.com/@PyConCZ,20170109,2040,214,0,,,Science & Technology,"The world is not perfect and network failures do happen. Complaining about instability might not always be enough. Especially when your system depends on multiple networked services and each of them is on a critical path to the final result.

In this talk we will recall why network failures happen. Reason what we can and cannot handle in the code. And see what Python standard libraries and a few popular ones such as urllib3 and requests can offer. 

And that's not all. Network Emulation (netem) module of Linux Traffic Control (tc) can even help with poor network simulation.

Now there is no excuse.",https://i.ytimg.com/vi_webp/bqe8EztTV7k/maxresdefault.webp,0,False,False,public,https://www.youtube.com/watch?v=bqe8EztTV7k,https://www.youtube.com/watch?v=bqe8EztTV7k
23,Thomas Levine: Tom's super easy way to make basic user interfaces in Python,https://www.youtube.com/watch?v=0flhwBJo3T0,0flhwBJo3T0,PyCon CZ,@PyConCZ,https://www.youtube.com/@PyConCZ,20170109,1993,208,3,,,Science & Technology,"Horetu (https://pythonhosted.org/horetu) exposes Python functions as command-line interfaces, web interfaces, and configuration files. In addition to being a very practical tool, horetu is interesting because its implementation demonstrates the capabilities of function objects. Finally, horetu can construct powerful interfaces and detailed documentation from functions that were written with no intent of being used with horetu; it is, consequently, a clear demonstration of the merits of following conventions.",https://i.ytimg.com/vi_webp/0flhwBJo3T0/maxresdefault.webp,0,False,False,public,https://www.youtube.com/watch?v=0flhwBJo3T0,https://www.youtube.com/watch?v=0flhwBJo3T0
24,Josef Rousek: Instagram and text-based machine learning,https://www.youtube.com/watch?v=RkiicAwJ7iM,RkiicAwJ7iM,PyCon CZ,@PyConCZ,https://www.youtube.com/@PyConCZ,20170109,905,204,2,,,Science & Technology,Simple Machine Learning technique based on document-term matrix can work pretty well even for photos when you have at least some content. I will show you how I got from zero to a decent recommendation engine and learned some Jupyter tricks on the way.,https://i.ytimg.com/vi_webp/RkiicAwJ7iM/maxresdefault.webp,0,False,False,public,https://www.youtube.com/watch?v=RkiicAwJ7iM,https://www.youtube.com/watch?v=RkiicAwJ7iM
25,"Miro Hrončok: If it Moves, Test it Anyway",https://www.youtube.com/watch?v=iFqF5IaWfy0,iFqF5IaWfy0,PyCon CZ,@PyConCZ,https://www.youtube.com/@PyConCZ,20170109,1694,181,5,,,People & Blogs,"If it Moves, Test it Anyway
So you have written a nice piece of code that does something on the Internetz: communicates with a web API, or gets a webpage and parses some important information from it.

Now you write tests and you want them to be part of the project, run on your CI etc., but:

* the API is secured by a secret token/password/cookie...
* the information on the webpage changes
* it's not even accessible from the wild web

So how do you test it? You can mock the server part (that's messy), you can spin off your own testing server (that's hard) or you can record the HTTP communication with betamax (that's super simple). I'll show you all the methods and their good, bad and ugly parts.",https://i.ytimg.com/vi_webp/iFqF5IaWfy0/maxresdefault.webp,0,False,False,public,https://www.youtube.com/watch?v=iFqF5IaWfy0,https://www.youtube.com/watch?v=iFqF5IaWfy0
26,Jarka Schovancova: Python and LHC Computing,https://www.youtube.com/watch?v=SpWxpIaWZ-w,SpWxpIaWZ-w,PyCon CZ,@PyConCZ,https://www.youtube.com/@PyConCZ,20170109,2064,180,1,,,Science & Technology,Have you ever wondered how Python helps the Large Hadron Collider physicists study the composition of matter on a sub-atomic scale? Interested in testing world-wide distributed computing infrastructure? Take part!,https://i.ytimg.com/vi_webp/SpWxpIaWZ-w/maxresdefault.webp,0,False,False,public,https://www.youtube.com/watch?v=SpWxpIaWZ-w,https://www.youtube.com/watch?v=SpWxpIaWZ-w
27,Vilibald Wanča: Because Web API Testing Should Be Easy,https://www.youtube.com/watch?v=PMsip6sXn2M,PMsip6sXn2M,PyCon CZ,@PyConCZ,https://www.youtube.com/@PyConCZ,20170109,1728,172,1,,,People & Blogs,"Web APIs are often called REST APIs, which recently became a part of the everyday life of many Python developers. Sure, it can be a blast to build an API with frameworks like Django or Flask, but writing tests for it can be a tedious drag: asserting every single HTTP code, set of headers, JSON responses, error states… you know the drill. Despite all that you do, you still need to assure your API clients won’t be exposed to any unexpected surprises. At Apiary, we've developed an Open Source testing framework called Dredd, which has baked in first-class Python support. It does all the heavy lifting and boring stuff
for you while allowing you to alter the test cases with arbitrary Python code.

Let Judge Dredd do your API justice.",https://i.ytimg.com/vi_webp/PMsip6sXn2M/maxresdefault.webp,0,False,False,public,https://www.youtube.com/watch?v=PMsip6sXn2M,https://www.youtube.com/watch?v=PMsip6sXn2M
28,Jacqueline Kazil: User-centered software projects,https://www.youtube.com/watch?v=4sP9ehSfbwE,4sP9ehSfbwE,PyCon CZ,@PyConCZ,https://www.youtube.com/@PyConCZ,20170109,2074,162,1,,,Science & Technology,"Open-sourced and inner-sourced projects often struggle to get engagement. Communities, such as Github and PyPi, are host to redundant projects and libraries. In the development space, how do you distinguish your project from others, get people excited to contribute to it, and ultimately create a successful open source project? The answer is to apply user-centered design techniques to the development of your project. User-centered design is usually applied to web applications and products on the front-end of a website, but these techniques can be applied to open source libraries. In user-centered open source projects, your users are those who type `pip install $your_library`. In this talk, Jackie will illustrate some user-centered techniques that have been used on her own project - Mesa (https://github.com/projectmesa/mesa), along with other successful open source projects.",https://i.ytimg.com/vi_webp/4sP9ehSfbwE/maxresdefault.webp,0,False,False,public,https://www.youtube.com/watch?v=4sP9ehSfbwE,https://www.youtube.com/watch?v=4sP9ehSfbwE
29,Kristi Progri a Jona Azizaj: How to build up a Python community and empower women,https://www.youtube.com/watch?v=g9nQyUIvXV8,g9nQyUIvXV8,PyCon CZ,@PyConCZ,https://www.youtube.com/@PyConCZ,20170109,1353,127,0,,,Science & Technology,"In 2012 not a lot of people were interested in Python in the relatively small city of Tirana, the capital of Albania. Even fewer girls were interested in Python. During our talk we will share the story of how we, a small but dedicated group of people, jump started the community in a small country like Albania and what other small cities and countries should avoid during their first steps in developing a Python community in similar conditions.
Most important we will share tips and tricks on how to keep the Python spirit alive for a long time after the first enthusiastic steps, with the goal that our shared experience will help other communities to make the first steps or grow even further. Also nowadays we are witnessing that the number of girls involved in technical fields, especially development, is really low and we are going to present what as the influence on low participation of girls and the steps we should take to fix it.",https://i.ytimg.com/vi_webp/g9nQyUIvXV8/maxresdefault.webp,0,False,False,public,https://www.youtube.com/watch?v=g9nQyUIvXV8,https://www.youtube.com/watch?v=g9nQyUIvXV8
